character,dialog
YON-KYO,"Have you seen a child going through a seizure?  It’s awful. If you don’t perform first aid in the first fifteen minutes, it’s over.  You have to take him to the hospital as soon as you can."
YON-KYO,"Dong-Ik was away on a business trip, and I was all by myself. Anyway, after that horrible experience, we’ve tried to go away for his birthday every year.  Last year we went to my parents’ house. This year, camping--"
YON-KYO,Now it’s all gone to crap.
CHUNG-SOOK,I see.
YON-KYO,"Dong-Ik doesn’t take it seriously. Growing pains, he says.  And he says living in a haunted house actually brings good fortune. Good for business or something. You know what though?  Business has been very good these past few years.  It’s funny--"
KI-TEK,God...  I can’t believe you lived here for so long.  I guess you had no choice...
KUN-SAE,Plenty of people live underground. More if you count semi-underground apartments!
KI-TEK,"So what was your plan?  You didn’t even have one, did you?"
KUN-SAE,I like it here.  It almost feels like I grew up here.  This might as well be my official address.
KUN-SAE,Please.  You have to let me stay here.
KUN-SAE,Please.  Talk to my wife.  We don’t have to fight. Where did she go?  She didn’t mean what she said.  The woman really has a heart of gold.  She stood by me the whole time I was in here. Four long years--
DA-HAE,You’re unbelievable.
YON-KYO,What?
DA-HAE,You didn’t even ask me.  I like japaguri too.
YON-KYO,I just--
DA-HAE,"Da-Song didn’t want it so you offered it to Chung-Sook.  Then you gave it to Dad.  Then instead of asking me, you decided to eat it all by yourself.  What, I didn’t cross your mind?"
CHUNG-SOOK,Da-Song!  Slow down!
YON-KYO,Da-Song!  Are you crazy!
DONG-IK,Da-Song Park! I can’t believe this.
DA-HAE,What the fuck is going on here?
YON-KYO,You should go sleep in the room. We’ll stay here with Da-Song.
DONG-IK,You too.  Stop looking at your phone and go to your room.
DONG-IK,"Dad to Da-Song, Dad to Da-Song. Currently standing by in the living room.  I’ll be here all night so call me if there’s an emergency."
DA-SONG,Copy that.  Over and out.
DONG-IK,"This is incredible.  You don’t think the teepee will leak, do you?"
YON-KYO,I bought it directly from an American vendor.  I think it should be okay.
DONG-IK,"Your son is quite unpredictable. Never easy, I’ll say."
YON-KYO,He’s been getting better...  Look. Signing him up for the Cub Scouts definitely paid off.  See how fast he set up that tent.
DONG-IK,Let’s just sleep here on the sofa tonight.  We’ll be able to see the tent from here.
YON-KYO,That sounds good.  That way we can keep an eye on Da-Song.
DONG-IK,Hold on. I know that smell.
YON-KYO,What?
DONG-IK,This is Mr. Kim’s smell.
YON-KYO,Mr. Kim?  Are you sure? I don’t know what you’re talking about.
DONG-IK,I guess you don’t know.  I sit behind him every day so I know the smell.
YON-KYO,Like poor people smell?
DONG-IK,No.  It’s not that strong.  It’s more like a subtle aroma that seeps into the air--
YON-KYO,Like old people smell?
DONG-IK,"No, no.  How should I put it-- Maybe the smell of an old radish pickle?  Or that smell when you’re washing a dirty rag?"
DONG-IK,I mean I like his driving.  And the man never crosses the line.
DONG-IK,"Sometimes he teeters very close, but he never actually crosses it. That’s all great.  But that smell. It definitely crosses the line. It just creeps into the backseat and surrounds you--"
YON-KYO,You think that’s what Da-Song was talking about?
DONG-IK,It’s hard to explain.  I smell it when I ride the subway sometimes.
YON-KYO,I haven’t ridden the subway in forever.
DONG-IK,There’s this unique smell that subway commuters have--
YON-KYO,What are you doing?
DONG-IK,"It feels like we’re in the backseat of a car, doesn’t it?"
YON-KYO,Clockwise.
DONG-IK,Do you have a pair of really cheap panties?
YON-KYO,Cheap panties?
DONG-IK,Those panties that Yun left behind.  Something like that. Real cheap and tacky.
YON-KYO,"No, I don’t have--  something so crude."
DONG-IK,"I must be a pervert.  I get hard thinking about those cheap, trashy pair of underpants."
YON-KYO,Where would I find something so-- horrendous. Down.
DA-SONG,"Mayday!  Mayday!  Dad, come in!"
DONG-IK,What is it?
YON-KYO,Is that Da-Song ?  What’s going on?
DA-SONG,I can’t go to sleep.  Over.
DONG-IK,So come inside!  Let’s all go to sleep in our comfy beds.
DA-SONG,No!
KI-JUNG,So what did you do?
KI-TEK,What are you talking about?
KI-JUNG,The basement.
KI-TEK,I tied them up so they can’t come out.
KI-JUNG,What are we going to do?
KI-JUNG,What do we do now?  What’s the goddamn plan?
KI-WOO,What would Min-Hyuk do?
KI-JUNG,Min-Hyuk wouldn’t have gotten himself in this mess in the first place!
KI-TEK,Calm down.  Both of you.
KI-TEK,"We made it out of that house, didn’t we?"
KI-WOO,We did.
KI-TEK,No one else knows about what happened in the house.  Am I right?
KI-TEK,So as far as I’m concerned nothing happened in there.  Do you understand?
KI-TEK,I know what I’m doing.  Daddy has a plan.  So you two just erase everything that happened today from your memory.
KI-JUNG,Okay.
KI-TEK,Let’s go home and wash up.
KI-WOO,Ow!
KI-TEK,Were you shocked?  Don’t touch it! Don’t touch the windows!  Just get what you need!
KUN-SAE,Mmm-mmmm!
MUN-KWANG,Vomiting is a symptom of--
MUN-KWANG,It’s supposed to be a symptom of--
MUN-KWANG,Honey-- Chung-Sook.  She--  That bitch kicked me in the face--
KI-WOO,"Hey, Dad."
KI-TEK,Hey...
KI-WOO,So--
KI-WOO,Your plan.  What is it?
KI-TEK,What are you talking about?
KI-WOO,You said you had a plan.  What are we going to do about-- The basement.
KI-TEK,Do you want to know how you make a foolproof plan?
KI-WOO,How?
KI-TEK,Don’t plan at all.  Have no plan.
KI-TEK,"If you plan, something will always go wrong.  That’s life. Look around.  Do you think these people got up this morning and said “Tonight I’m going to sleep on a dirty floor with hundreds of strangers”?  But look where they are now.  Look where we are."
KI-TEK,"That’s why you should never plan. If you don’t have a plan, you can’t fail.  You can’t do anything wrong.  Doesn’t matter if you kill someone or commit fucking treason. Nothing fucking matters.  You understand?"
KI-WOO,"I’m sorry, Dad."
KI-TEK,For what?
KI-WOO,Everything.  I’m going to make it right.
KI-TEK,Stop talking nonsense. Why are you hugging that thing?
KI-WOO,This?
KI-WOO,It wants to be with me.
KI-WOO,It’s true.  It keeps following me.
KI-TEK,Get some sleep.
KI-WOO,I knew it was a sign when Min-Hyuk gave it to me.  A symbolic gift...
YON-KYO,Jessica!  Sorry to call you so early on a Sunday.  Are you free for lunch today?  We’re planning a surprise party for Da-Song.
KI-JUNG,You’re having a birthday party?
YON-KYO,Yes.  Da-Song would be so thrilled to see you there.
YON-KYO,"The food will be amazing.  Pasta, gratin, salmon steak...  You know I’m an excellent chef, right?  You have to come."
KI-JUNG,Sure...
YON-KYO,You have to be here by one o’clock at the latest.  And we’ll count today as a lesson. You know what I mean? See you very soon!
DA-HAE,"Hey, Mom.  The birthday party-- Should I invite Kevin?"
YON-KYO,What an excellent idea!  Why not? You call him.
DA-HAE,On it!
YON-KYO,"Sleep, sleep.  You had a long night.  You need some more rest."
DONG-IK,Thanks. Don’t you have to do the rounds?
YON-KYO,"Yep.  Wine shop, bakery, florist, grocery store--  I’m on top of it. I already called Mr. Kim and told him to come early.  I’m going to pay him extra for today."
DONG-IK,Perfect.
YON-KYO,I want you to go to the storage basement.  We should have about ten party tables in there.
CHUNG-SOOK,Okay...
YON-KYO,Let’s bring them all out.  Clean them so they’re bright and shiny. We’ll set them up in a semi-circle around Da-Song’s tent--
YON-KYO,"Crane Formation!  You know, right? The formation that General Yi Soon Shin famously used during the Battle of Hansan Island."
YON-KYO,"Think of Da-Song’s tent as a Japanese battleship.  We’ll surround it in a semi-circle, like the wings of a crane.  The barbecue grill will go next to the tent--"
YON-KYO,That sounds great.  Bring your husband too!  And please -- don’t bring any gifts.
YON-KYO,I just want you to come and enjoy the food!
YON-KYO,"Come.  You can take a break from cooking today. Yes, of course.  Daytime is the best time for vino! Well, we’d be so grateful if you could sing a song at the party."
YON-KYO,"No dress code.  It’s just a casual affair.  You can come in your pajamas if you want. And please, no gifts.  I just want you to come and enjoy.  That’ll be the best gift for us. You have a Mini Cooper, right? Great.  We can squeeze it in next to our car.  It’ll fit just fine."
DONG-IK,He’s still sleeping.
YON-KYO,"Did you see the sky today? Crystal clear.  Zero air pollution.  Rain washed it all away.  Of course camping was a major fail because of the rain, but we get to have a garden party instead, yay!  It was actually a blessing in disguise."
YON-KYO,I almost forgot.  Please please please don’t bring any presents. You have to promise.
DA-HAE,"You were somewhere else, weren’t you?"
KI-WOO,What?
DA-HAE,When we were kissing just now. You were somewhere else.  Right?
KI-WOO,No...
DA-HAE,Stop lying.  You’re still thinking about something else.
KI-WOO,They’re all so gorgeous.  Even though they had to come at the last minute.  So cool.  Laid back.
KI-WOO,Da-Hae.
DA-HAE,Yeah?
KI-WOO,Do I look like I belong here?
DA-HAE,What do you mean?
KI-WOO,Do I look like I belong in this house?
DA-HAE,Where are you going?
KI-WOO,I need to go downstairs.
DA-HAE,Stay.  Let’s hang out.
KI-WOO,I need to go down.
DA-HAE,Those people are boring.
DA-HAE,Just stay with me.
KI-WOO,Not there.  Further down.
DA-HAE,Whoa.  What is that thing?
DONG-IK,"I can’t believe we’re doing this. Look at us.  A couple of middle- aged men, wearing silly costumes--"
KI-TEK,It’s fine...
DONG-IK,"I’m really sorry, Mr. Kim.  Mrs. Park made me do this.  I didn’t have a choice. It’s really simple.  There’s going to be a cake ceremony, and Jessica, the art teacher, is going to bring out the cake.  She’s walking, walking, walking, she’s going to present the cake--   Then we appear from the trees swinging our axes, ambushing her!  Because, you know, we’re the bad guys."
KI-TEK,Sure.
DONG-IK,"At that moment, Da-Song, the good Indian, attacks us with his axe. A battle ensues, and Da-Song heroically saves Ms. Jessica and the cake!  Everybody applauds. You get the idea.  I know it’s ridiculous."
KI-TEK,I guess Mrs. Park enjoys throwing parties.
DONG-IK,I suppose she does.  She put a lot of effort into Da-Song’s birthday this year.
KI-TEK,How thoughtful of her.  And you too.
KI-TEK,"What can you do, I guess.  You love them, right?"
DONG-IK,"Mr. Kim, you’re technically working today, aren’t you?"
KI-TEK,"Yes, sir."
DONG-IK,Then just think of this as part of the job.
KI-TEK,Mr. Park.  I think you went over the line.
DONG-IK,What did you say?
KI-TEK,No.  I mean this.
KI-JUNG,Have you been down there?
CHUNG-SOOK,"No, I’ve been too busy."
KI-JUNG,Shouldn’t we try to talk to them? Try to reach an agreement.
CHUNG-SOOK,I think so too.  We all got too emotional yesterday.
KI-JUNG,I’ll go down there and see how they’re doing.
CHUNG-SOOK,Here.  Take this with you.  I made it for them just in case.  They’ll be more willing to talk if their stomachs are full.
YON-KYO,Jessica!  I was looking for you! What are you doing there?  Come out here.
YON-KYO,"This cake is very symbolic.  It has a therapeutic significance, you know, related to Da-Song’s trauma.  I want you to bring it out, Jessica.  It has to be you. It’ll be the highlight of the day!"
DA-HAE,"Kevin!  Kevin, where are you?"
KUN-SAE,Don’t move!
KUN-SAE,Chung-Sook!  Where are you!  Come out you fucking bitch!
CHUNG-SOOK,Ki-Jung!  Wake up!
CHUNG-SOOK,"Put pressure on the wound, Ki- Jung!  You have to stop the blood!"
KI-TEK,Help!  Please help us!
YON-KYO,"Mr. Kim, get the car!  We can’t wait for an ambulance!"
DONG-IK,Kim!  Get the car!
YON-KYO,Fifteen minutes!
DONG-IK,Keys!  Give me the keys!
DONG-IK,The keys!
KI-WOO,He was the first person I saw when I woke up a month later.
KI-WOO,A detective.  Although he didn’t look like one.
KI-WOO,Then I saw a doctor who didn’t look like a doctor.  He told me one of the side effects of brain surgery was laughing for no reason.
KI-WOO,Maybe that’s why I laughed when I heard that Ki-Jung died.  They said she died from loss of blood.
KI-WOO,"I also laughed when Mom and I received our sentences.  We avoided the slew of charges they threw at us -- forgery, home invasion, voluntary manslaughter, which we argued was self defense -- and walked away with probation."
KI-WOO,Same when I saw Ki-Jung again for the first time since the incident.
KI-WOO,I laughed then too.
REPORTER 1,"The murders, which had no apparent motive and took place in a quiet, upper-class neighborhood, have confounded the police.  The other suspect, an unidentified homeless male, was murdered himself at the scene, further shrouding--"
REPORTER 2,"The driver, Kim, was known to have a good relationship with his employer Park, and police have yet to narrow down a concrete motive. Kim**’s whereabouts are still unclear after he was last seen fleeing the scene, and police continue searching for leads.  His cell signal was last active at the crime scene--"
KI-WOO,Of course neither Mom or I have had any contact with you since that day.
KI-WOO,I just feel awful those poor detectives who have to follow us all day.
KI-WOO,I did have a strong feeling about where you might be.
KI-WOO,So when the season changed and the news slowed down -- and when the detectives finally stopped trailing us -- I started climbing the mountain.
KI-WOO,You can see the house pretty well from there.
KI-WOO,"I don’t know why, but that day I just felt like staying longer."
KI-WOO,Dash.  Dot.  Dash-dash--
KI-TEK,"Dear Son.  Perhaps you, if no one else, will be able to read this letter--"
KI-TEK,You were a Boy Scout so I’m hoping this will somehow reach you.
KI-TEK,How is your health?  Your mother I’m not too worried about.  I’m sure she’s healthy as an ox. I’m doing well too.  Although I cry often when I think of Ki-Jung.
KI-TEK,I still can’t believe what happened that day.  It almost feels like a dream.
KI-TEK,"I knew, as soon as I ran out of that gate, where I had to go."
KI-TEK,"Even in the complete madness, I had the foresight to grab some water and food--"
KI-TEK,I realized only later that a house with such a morbid history would not be appealing to potential buyers.  I would have to stay in an empty house for a long time.
KI-TEK,One good thing about being alone was that I was finally able to give her a proper funeral.
KI-TEK,"Tree burials are all the rage these days, so I guess no one can say I didn’t give her a proper farewell."
KI-TEK,The real estate agents were smarter than I thought.  They somehow managed to sell the house to a family that just moved to Korea.
KI-TEK,"The parents both work, and the kids are at school most of the day, which should have made them ideal housemates for me.  But unfortunately they have a live-in maid, and I risk my life every night for the tiny window of opportunity I have to venture outside."
KI-TEK,"Luckily, Germans don’t only eat German food.  I thought I would have to eat sausage and beer for the rest of my life."
KI-TEK,"When you’re in here, you lose your sense of reality."
KI-TEK,But today was a good day.  I wrote this letter to you.
KI-TEK,"Take care, Son."
KI-WOO,Father.  Today I made a plan.
KI-WOO,A long-term plan.
KI-WOO,I’m going to make a lot of money.
KI-WOO,"First I’ll need to go to college. Then I’ll get a job and get married.  But ultimately, I want to get rich."
KI-WOO,"And when I get rich, I will buy this house."
KI-WOO,We’ll pick a sunny day to move in.
KI-WOO,Then all you have to do is walk up the stairs.
KI-WOO,"Come out, Dad."
KI-WOO,"But I have a problem, Father -- I have no idea how to get this letter to you."
