character,dialog
GRETA,"They could be allowed to join the women later, when the women have established themselves and are thriving."
AUGUST,"Should we add, thriving as a collective, literate community?"
MARICHE,Literate is your word. Not ours. We don’t need your university language to make our plans.
AGATA,Put it in. We know what it means. Continue.
GRETA,"Young boys, simple minded boys of any age, Cornelius who is confined to a wheelchair, will accompany the women."
MARICHE,I vote for the first option. They should leave with us if they wish.
MEJAL,The first option is ridiculous and should be crossed off the list.
MARICHE,"Why are some ideas written down and considered, and others crossed out?"
MARICHE,I want to leave.
MARICHE,I’d like to strangle myself.
ONA,"But Mariche, it’s possible that all the men would choose to leave with us. Then all we’d be doing is re- creating our colony, with all of its dangers elsewhere, wherever we end up."
AGATA,And the men would most definitely leave with us because they can’t survive without us.
GRETA,"Well, not for longer than a day or two."
SALOME,There is no possibility of the men leaving with us. Whatever we decide. And we have not decided to leave. I would like to remind everyone of that.
AGATA,Clearly these are unrealistic ideas. And how are we to leave at all if we have never been allowed to even see a map of the world?
AUGUST,I can secure a world map for you.
AGATA,Where on earth would you get a map August?
AUGUST,I also have a map of this specific region.
GRETA,That will do. We aren’t planning to travel the planet.
ONA,Perhaps we are. Did you know that the migration period of butterflies and dragonflies is so long that it is often only the grandchildren who arrive at the intended destination?
AUGUST,"So. Yes, so."
ONA,"Perhaps, if we went beyond where the map shows us, we could create our own map as we go."
GRETA,Now that is a unique idea.
SALOME,So now you want to leave? Ona?
GRETA,Oh.
ONA,I’m fine.
SALOME,She’s having one of her episodes.
GRETA,"Please, God. Restore Mejal’s equilibrium."
AGATA,"Almighty Father, in all humility and supplication we ask Thee for Thy abundant kindness this moment."
AGATA,"Please, in your beneficence, heal her. Please, we ask of Thee, envelop her in your strength and everlasting love, and please drive out the sickness that afflicts her now."
SALOME,Take the cigarette out of her pocket.
MEJAL,Alright. Help me up.
AGATA,Praise be to God.
MARICHE,Why is it only Mejal who has these sudden-
SALOME,Be quiet.
MARICHE,We were all attacked. Not all of us draw so much attention to ourselves.
MEJAL,Attention? What attention? I talk less than all of you put together. How have I offended you?
MARICHE,You have these “attacks.” You smoke. Why? Why is it so much harder for you than for us? We were all attacked. All of us. And the rest of us are all able to get through a day without-
GRETA,"We are wasting time by passing this burden, this sack of stones, from one to the next, by pushing our pain away. We mustn’t do this. We mustn’t play hot potato with our pain. Let’s absorb it ourselves, each of us. Let’s inhale it, let’s digest it, let’s process it into fuel."
GRETA,"Speak, Mejal. We are listening."
MEJAL,They made us...they made us disbelieve ourselves. That was worse than...
SALOME,Mejal?
GRETA,Perhaps Mejal’s episode was brought on by the thought of us creating our own map.
NEITJE,But I will draw it if we need-
GRETA,Not a fear of the do-it-yourself map making. But of what it means: that we are masters of our own destiny. That we would be setting off into unknowable space.
AGATA,Yes. It makes sense that one would panic.
MEJAL,I am not panicking.
AGATA,"Yes. But panic, in this case would be understandable."
MEJAL,But I’m not.
ONA,"Klaas, when he returns, may take horses or livestock that we will need along the way."
SALOME,"Along the way? We’re not leaving. You are changing your mind, Ona."
ONA,"I don’t believe that is a sin, is it?"
MARICHE,"How will we be forgiven for all this? How will we be forgiven if not by the elders whom we have disobeyed and who, if we leave, we will never see again. It will leave us unforgiven, with black hearts, and unable to enter the kingdom of god."
GRETA,Perhaps there will be other elders or men of God that will be able to forgive us our sins. Ones we haven’t met yet.
SALOME,"We do not have to be forgiven by the men of God for protecting our children from the depraved actions of vicious men who are often the very same men we are meant to ask for forgiveness! If God, in the book of Matthew asks: Let the children come to me and do not hinder them, then mustn’t we consider it a hindrance when our children are attacked? If God is a loving God He will forgive us Himself. If God is a vengeful God then He has created us in His image. If God is omnipotent then why has He not protected the women and girls of this colony? I will destroy any living thing that harms my child. I will tear it limb from limb, I will desecrate its body and I will bury it alive. I will challenge God on the spot to strike me dead if I have sinned by protecting my child from evil and by destroying the evil that it may not harm another! I will lie, I will hunt I will kill and I will dance on graves and burn forever in hell before I allow another man to satisfy his violent urges with the body of my four-year-old child!"
AGATA,No. Not dancing. Not desecration.
MEJAL,Salome.
AGATA,"I suggest that we think of what is good. “Whatever is true, whatever is honourable, whatever is just, whatever is pure, whatever is pleasing, whatever is commendable, if there is any excellence and if there is anything worthy of praise, think about these things... and the peace of God be with you.”"
THE WOMEN,"Whatever is true, whatever is honourable, whatever is just, whatever is pure, whatever is pleasing, whatever is commendable, if there is anything worthy of praise, think about these things… and the peace of God be with you."
SALOME,I will become a murderer if I stay. What is worse than that?
ONA,I know what these are. These are letters. But what are these?
AUGUST,"They are commas. They signify a short pause, or a breath, in the text."
AUGUST,There is also a butterfly called the comma.
ONA,Is that so?
AUGUST,Yes. It’s called the comma because-
ONA,"No. Let me guess. Because it flits about from leaves to petals, only briefly stopping on its way? Because its journey is its story, never stopping, only pausing, only moving."
ONA,Aha!
AGATA,"Salome, there is nothing worse than being a murderer. If you will become a murderer by staying in the colony, side by side with the men who are responsible for the attacks then you must, to protect your own soul and to qualify for entry to heaven, leave the colony."
MARICHE,We are not all murderers.
ONA,Not yet.
AGATA,"I have done what the verse from Philippians instructed, which is to think about what is good, what is just, what is pure, and what is excellent. And I have arrived at an answer. Pacifism. Pacifism is good. Any violence is unjustifiable. By staying here, we women would be betraying the central tenet of our faith, which is pacifism, because by staying we would knowingly be placing ourselves in a direct collision course with violence, either by us or against us."
AGATA,"This colony is the only home I’ve ever known, and I don’t want to leave. But by staying, we would be inviting harm. We would be in a state of war. We would turn this colony into a battlefield."
ONA,We cannot become murderers. And we cannot endure any more violence. That is why we must leave.
MEJAL,"Let’s shake a leg, then."
ONA,"I’m also thinking about the verse from Philippians and I’m thinking about what is good. Freedom is good. It’s better than slavery. And forgiveness is good. Better than revenge. And hope for the unknown is good, better than hatred of the familiar."
MARICHE,What about security and safety and home and family? What about marriage and love?
ONA,"I don’t know about those things, any of them. Except for love. And even love is mysterious to me. And I believe that my home is with my mother, with my sister and with my unborn child, wherever they may be."
MARICHE,Will you not hate that child? That child is the child of a man who inspires violent thoughts in you.
ONA,Mother! Again!
ONA,I already love this child more than anything.
ONA,He or she is as innocent and lovable as the evening sun. And so too was the child’s father when he was born.
ONA,Are you crying?
MARICHE,"If you are saying that forgiveness is better than revenge, aren’t you saying that we must stay here and forgive the men?"
ONA,"We cannot forgive because we are forced to. But if there is distance, perhaps I can begin to understand how these crimes may have occurred. And maybe from that distance, I can pity these men, and perhaps forgive them. And even love them."
AGATA,And so we must leave in order to have that distance.
ONA,Not fighting. But moving on. Always moving. Never fighting. Just moving...
MARICHE,Snap out of it.
SALOME,"You snap out of it, Mariche."
MEJAL,All of you snap out of it and focus. Have you lost your minds? The sun is gone.
GRETA,I want to tell another story about Ruth and Cheryl.
GRETA,"I was always frightened of the northern road out of the colony. So many gullies on either side of the road that are so deep. And it’s so narrow. The buggy used to lurch side to side. Ruth and Cheryl were simply following my commands on the reins but they were jerky and frenetic. It was dangerous. It was only when I learned to focus my gaze far down ahead of me, down the road, and not on the road immediately in front of Ruth and Cheryl that I started to feel safe."
GRETA,Leaving will give us the more far- seeing perspective we need to forgive.
GRETA,"Which is to love properly, and to keep the peace, according to our faith."
GRETA,"Therefore, our leaving wouldn’t be an act of cowardice or abandonment. It wouldn’t be because we were excommunicated or exiled. It would be a supreme act of faith, a step towards love and forgiveness."
GRETA,Leaving is how we demonstrate our faith. We are leaving because our faith is stronger than the rules. Bigger than our life.
GRETA,I am sorry. But I think I might be dying.
MEJAL,Mother. You are not dying. Your glasses need cleaning.
GRETA,I thought the lights were going out.
MARICHE,What are you laughing at? We can’t leave. It would be better to stay and fight than leave.
ONA,"Do you really mean that you want to stay and NOT fight? Because when was the last time you had the strength to stand up to the aggression of Klaas, to protect your children, or to get out of harm’s way?"
MARICHE,"Who are you to tell me what kind of wife and mother to be when you are neither one yourself? You are a spinster, a lunatic! A whore! An unwed mother!"
SALOME,"Ona was made unconscious and raped like the rest of us and now is pregnant as a result! How dare you call her a whore! Mariche, are you not afraid your own sweet boys will become monsters like their father because you do nothing to protect them or yourself-"
AUTJE,Stop.
SALOME,"Nothing to educate them, nothing to teach them the horror of their father’s ways, the sickness..."
AGATA,"Now. I. Have. Heard. Enough! Are you women not aware that we are talking about leaving? We are a large group. Many things can go wrong and our time is fleeting! For the love of our Lord Jesus Christ and precious Saviour will you shut your pieholes, please!"
MARICHE,How dare you pass judgement on me.
ONA,It wasn’t judgement. It was a question.
ONA,"I am sorry, Mariche. I am sorry that what I said hurt you."
MARICHE,Fuck it off.
GRETA,Sit down Mariche.
NEITJE,It’s “fuck off” I think.
ONA,"I am sorry. I am saying sorry, not just to leave the hurt behind, but because I feel, truly, that I should not have said something harmful."
ONA,And Mariche. I am sorry because you don’t need or deserve more harm.
MARICHE,Who are any of you to pretend I have had a choice?
GRETA,I am also sorry Mariche.
GRETA,"Because, Mariche. I couldn’t - I didn’t try to protect you or your children from Klaas. All this time. And what you say is true. You had no choice. You forgave him, again and again, as you were told to. As I told you to."
MARICHE,It is not only the men and boys who have been excellent students.
SALOME,Yes. All of us have been infected by a poisoned way of thinking.
MARICHE,And so you have judged me. For what I have endured.
AGATA,"I think, Mariche... I think that we are all very sorry. What you have been required to endure with your violent husband was a..."
GRETA,A misuse of forgiveness.
MEJAL,Is there such a thing? Is there a forgiveness that is not good?
AGATA,"Perhaps forgiveness can, in some instances, be confused with permission."
ONA,"Perhaps it will also be a difficult task to forgive each other, and ourselves, after all that has happened."
GRETA,What in heaven’s name?
AGATA,Nettie. Please. Be reasonable. Make an exception and tell us what is happening. There are only women in this loft. Nettie!
MARICHE,What has happened to him?
AGATA,Nettie. Be realistic. What has happened to Julius? Please! Just speak this once!
JULIUS,My nose. There is a cherry pit in my nose!
MARICHE,"Blow. Now. Blow, Julius."
ONA,"If Julius has put a cherry pit up his nose it means he has been eating cherries or he has, at least, been near cherries."
ONA,We have no cherries in the colony.
MARICHE,Klaas sometimes brings them back from the city.
AGATA,Who gave you the cherries? Julius!
JULIUS,Papa.
MARICHE,Papa is home now?
JULIUS,No. I saw him out on the road. He’s collecting animals.
MARICHE,If you see him again you can tell him that we are all quilting.
JULIUS,Isn’t that lying?
MARICHE,No. It’s... something else. Go now. Go with Nettie.
GRETA,Have we made a decision? Are we leaving?
AUTJE,Yes.
GRETA,We are leaving because…
AUTJE,We know why we are leaving. We are leaving because we cannot stay.
NEITJE,What happens when we become hungry? Or afraid?
ONA,We are not animals. Hunger and fear cannot be our guide.
MEJAL,Should we not have more perspective than animals?
AGATA,Animals have perspective. Remember? The dragonflies? They set out knowing that they will not see the end of their journey but their children will.
MEJAL,Please for the love of Joshua Judges Ruth can we start talking practically!
AGATA,I like that. “For the love of Joshua Judges Ruth.”
GRETA,"We will take young boys under twelve with us. And we will allow the men to join the women later, under certain conditions."
AUTJE,I like it.
NEITJE,Me too.
GRETA,"Would everyone agree to this now, knowing that our minds may change in the future?"
ONA,No. Not yet.
SALOME,We can’t leave.
AGATA,Aaron. I know.
SALOME,He is just over twelve. Just barely.
GRETA,"The sadness of leaving Aaron behind for the time being will only spur us all, all of us grieving mothers, to rebuild a new and better colony for everyone."
SALOME,Why are boys aged thirteen and fourteen left behind? Why wouldn’t they leave with us?
AGATA,Surely we can’t be afraid of boys of this age? Why couldn’t they join us if we leave?
ONA,August. You’re the boys teacher. What is your feeling about this? Do boys of this age pose a threat to our girls and women?
AUGUST,"Yes. Possibly. Every one of us, male or female, poses a potential threat. Thirteen and fourteen-year- old boys are capable of causing great damage to girls and women, and to each other."
AUGUST,"It is a brash age. They are possessed of reckless urges, physical exuberance, intense curiosity that often results in injury, unbridled emotion, including deep tenderness and empathy, and not quite enough experience or brain development to fully understand or appreciate the consequences of their actions or words. They are similar to the yearlings; young, awkward, gleeful, powerful. They are tall, muscular, sexually inquisitive creatures with little impulse control, but they are children. They are children and they can be taught. I’m a two-bit schoolteacher, a failed farmer, an effeminate man, and above all, a believer."
AUGUST,"I believe that with direction, firm love and patience these boys are capable of relearning their roles as males in the colony. I believe in what the great poet Samuel Taylor Coleridge thought were the cardinal rules of early education. “To work by love and so generate love. To habituate the mind to intellectual accuracy and truth. To excite imaginative power.” He said “Little is taught by contest or dispute, everything by sympathy and love.”"
AUGUST,"I believe those boys should be allowed to leave with the women, providing the women choose to leave."
MARICHE,"It was a yes or no question.You shit like any other man, why don’t you talk like one?"
MARICHE,Sorry.
SALOME,I won’t leave Aaron.
AGATA,"I would like to make a proposal. We must protect all of our children. Not only our daughters. All boys under the age of fifteen, and the ones that require special care must accompany the women."
SALOME,How do you mean must?
ONA,What if they refuse? If they don’t want to leave?
MARICHE,We can’t carry teenagers on our backs.
AGATA,"We will try to influence our sons. But we cannot force them, and they may refuse, it is true."
NEITJE,But that would be very sad.
AGATA,"Let’s talk about our sadness after we have nailed down our plan. August, you would stay here to teach the boys who remain?"
NEITJE,What’s the point in trying to teach them? Fifteen-year-old boys still believe that throwing horse turds at the girls while we do the milking shows their love.
AUTJE,"But a boy who truly loves you will intentionally miss when he throws the shit, or not throw it with quite as much force."
SALOME,My most hopeful dream for my four year old girl is that one happy day a boy will intentionally miss hitting her with a clump of shit.
MEJAL,"Yes. The day every mother dreams of, the hope that gets us through the darkest hours."
AUTJE,He’s here.
MARICHE,Klaas.
GRETA,He has Ruth and Cheryl!
AGATA,"Everyone, back to your houses. Go collect your children, and pack up. August, get the map. Greta and I will pack the food supplies. If anyone asks, we were quilting here."
AGATA,"Neitje and Autje! You must run now to every house and tell the women, we are leaving!"
SALOME,Tell them to bring everything they can. We will assemble outside the washhouse!
SALOME,And pin up your hair!
MEJAL,"I am worried about the women who have voted to do nothing. If Klaas, or any other man has returned, there is a high risk that these women will inform them that we are plotting."
ONA,We must have faith that the Do Nothing women will not inform on us.
AUGUST,"But some, like Scarface Janz, believe that to fight or to leave is a sin. What about her?"
ONA,"What about her, August?"
AUGUST,Do you have faith in her?
ONA,"I must have faith in all of us, right now."
GRETA,Mariche. Be careful.
ONA,"Breathe, mother."
ONA,Breathe and slow down. You always hold your breath when you’re exerting yourself.
ONA,Don’t laugh while you’re on the ladder. Concentrate.
AGATA,We will have to get an early start tomorrow morning. Let’s meet here again at sunrise. All of us.
GRETA,Don’t go. Stay with me tonight. Or I will go with you.
MARICHE,"If I don’t go home, it will draw attention to all of us. I must behave as though everything isn’t about to change."
GRETA,Mariche.
MARICHE,"Go home, Mother. I will see you at sunrise."
NEITJE,An hour after sunrise. We congregate on the road by the wash house.
DARK-HAIRED WOMAN,Do we bring-
AUTJE,Everything. Bring everything.
CORNELIUS,Why?
AUTJE,We meet an hour after sunrise. On this road. We need your buggy.
WOMAN,"Thank you, sister."
NEITJE,An hour after sunrise we leave. We meet behind the wash house.
AUTJE,And we need your buggies. Both of them.
CLARA,Tomorrow?
NEITJE,You will be there?
CLARA,I have so much to do.
SALOME,So. We will need your help. The horses need to be brushed. Saddled.
MIEP,Mama. I’m hurting.
SALOME,"The pills aren’t working. I think they are for calves, not people."
ONA,But she is small. They’ll work.
SALOME,She is small. But she’s not a calf.
ONA,Psst! August!
ONA,Come. Sit with me.
AUGUST,Here is the map.
ONA,Where are we?
AUGUST,Here.
ONA,Here. This is where we are.
AUGUST,I’ve created a legend.
AUGUST,For the map. I’ve drawn asterisks on the map that coincide with pictures in the legend.
ONA,What do the pictures show?
AUGUST,"Rivers, roads, towns and cities and borders, train tracks. See?"
AUGUST,This is north... south... east... and west.
ONA,But the map moves. How do we know which direction the map should be facing?
AUGUST,Celestial navigation. Let me show you.
AUGUST,Do you know of the Southern Cross?
AUGUST,"You... and the women, can use the Southern Cross for navigation. If you clench your right fist like this-"
AUGUST,Now align your first knuckle with the axis of the Cross.
AUGUST,"Now. The tip of your thumb, here, will indicate south."
AUGUST,Will you show the others?
ONA,We will have a lesson in navigation.
AUGUST,Ona.
AUGUST,Did you already know about this little trick?
ONA,Of course. Of course I did.
AUGUST,I wish there was something I could tell you that you didn’t already know.
ONA,What will become of you when we leave?
ONA,I hope... I hope that you can help the boys. I hope that you can help them to be truthful. And to listen. Like you do.
SALOME,Where are Mariche and Autje?
GRETA,They will be here. I pray they will be here.
MEJAL,Concentrate on lifting your feet higher when you take steps. Don’t shuffle. You’ll trip again.
GRETA,I am very tired. My body is heavy.
NEITJE,Please. Please. Be gentle. You are blinding me.
ONA,August. Did you dream last night?
AUGUST,Yes.
GRETA,Is he gone?
AUTJE,He’s sleeping. Dead to the world. He was very drunk.
GRETA,Tell me what happened.
AUTJE,"Father caught me sneaking back into the house, late and then he went to the barn and found we had taken the horses."
SALOME,Did you tell him what we were planning?
AUTJE,She did. But it was because he wouldn’t stop hitting me and she was trying to distract him.
MARICHE,Yes. But I also told him because I suddenly felt very...
MARICHE,"I don’t think he believed me. And if he did, I don’t think he’ll remember. He’ll be passed out in the barn all morning I’m sure."
AGATA,So. Yesterday was a day for talking. Today is a day for action. When Klaas wakes up he may go to the city to alert the other men. We have decided to leave before that happens. Is that accurate?
AGATA,We have ruled out the option of staying because-
MARICHE,"I thought today was a day of action, not talk."
MARICHE,We have decided that we want... that we are entitled to three things.
GRETA,What are they?
MARICHE,We want our children to be safe.
MARICHE,We want to be steadfast in our faith.
MARICHE,We want to think.
GRETA,Yes.
AGATA,Praise God.
SALOME,"Yes, that’s it."
MEJAL,Precisely.
SALOME,Well it’s not precisely put. But it sounds perfect to me. A perfect beginning.
MEJAL,"Salome, will you use your last breath on earth to correct me?"
SALOME,"Yes, if that is what is needed."
MEJAL,What if we feel guilt? What if it overwhelms us?
AGATA,"We will feel pain and we will feel uncertainty and we will feel sadness, but not guilt."
MARICHE,We may feel guilty but we will know we are not guilty.
MEJAL,"We may feel homicidal, but we will know we are not killers."
ONA,"We may feel vengeful, but we will know we are not raccoons."
SALOME,"We may feel lost, but we will know we are not losers."
MEJAL,Speak for yourself.
SALOME,I always do. You should try it too.
AGATA,We may feel guilt and we may feel sadness. But we will endure it. We’re embarking on a journey. We are making a change that we have interpreted as being a testament to our faith and to our instincts as mothers. We must believe in it.
GRETA,"We don’t know everything that will happen. But we’ve made our plan. And, yes, we must believe in it."
AGATA,"You can speak whenever you want, August, and you don’t have to raise your hand. You’re the teacher!"
AUGUST,It’s alright. It wasn’t important.
AGATA,There is work to do. We must stop talking and prepare to leave.
ONA,Uncle Penner!
AGATA,Earnest!
EARNEST,What are you doing here in my loft? Are you angels? Are you lost? Will you help me with my bath?
EARNEST,What are you bitches plotting?
AGATA,"Oh, Earnest. My sweet cousin. We’re getting old, aren’t we?"
EARNEST,Are you devils?
AGATA,No. We’re your friends.
EARNEST,Are you plotting to burn down my barn?
AGATA,"No, Ernie. There’s no plot. We’re only women talking."
EARNEST,Will you help me with my bath?
MEJAL,Why don’t I take you back to your house and give you a washing. I’ll give you a bath and get you something to eat.
AGATA,"Will you make sure the water you use to wash Earnest is warm, but not hot, not scalding?"
AGATA,Be quick.
AGATA,There is mint growing next to the lower barn door! You could pick some of it and add it to the warm water. Earnest would love that!
SALOME,Mother?
AGATA,I’m just saying goodbye.
GRETA,I’m nervous.
ONA,We’re all nervous. We can’t avoid nervousness.
AUTJE,We hid Ruth and Cheryl for you. They are ready to go.
GRETA,Ruth and Cheryl!!! Really??!!!
GRETA,"Well, my girls."
MARICHE,"We’ll head out, then."
GRETA,Yes. Let’s go.
SALOME,"We’ll need to find guns, in case anyone tries to stop us."
AGATA,No. We won’t have guns. We must begin peacefully. As we mean to continue.
SALOME,We don’t know where we are going.
GRETA,We don’t. We can’t. But we must go anyway.
AGATA,Are the children clean and ready?
AGATA,And their things are packed? They are fed?
AGATA,"Thank you, Melvin."
MELVIN,Thank you. Thank you for saying my name.
AGATA,"Melvin, are you ready for the journey?"
MELVIN,No. I am not ready.
MELVIN,But I am coming with you.
GRETA,"Yes, who of us can say we’re ready, after all?"
MARICHE,I can.
