character,dialog
AUGUST,The attacks were originally attributed to ghosts and demons.
AUGUST,"When the women woke up feeling drowsy and in pain, their bodies bruised and bleeding, many believed they were being made to suffer as punishment for their sins. Many accused the women of lying for attention or to cover up adultery."
SALOME,Hundreds of times. All of us.
ONA,They said we were dreaming. But then we realized that we were dreaming one dream and it wasn’t a dream at all.
SALOME,They told us that it was Satan. Or the result of wild female imagination.
ONA,I’m glad you’re back August. It’s good that you came back.
NEITJE,“Do nothing.”
SALOME,“Stay and fight.”
SALOME,"""Leave""."
NEITJE,"""Leave""."
AUGUST,"I have been in love with Ona Friesen for most of my life. This morning she found me, having lost my faith in everything."
ONA,August.
ONA,Where are you going?
AUGUST,Nowhere.
ONA,Early this morning I saw a squirrel and a rabbit.
AUGUST,Oh.
ONA,"The squirrel charged the rabbit. Just as the squirrel was about to make contact with the rabbit, the rabbit leapt straight up into the air. Then the squirrel turned around and charged the rabbit from the other direction and the rabbit
leapt into the air and the squirrel missed."
ONA,They were playing!
AUGUST,Is that so?
ONA,"Maybe I wasn’t meant to have seen them playing. It was very early in the morning, and I was the only one roaming around."
AUGUST,But you really saw that?
ONA,Yes. I saw it with my own eyes.
ONA,We need you.
AUGUST,What do you need me for?
ONA,We need you to take the minutes of our meeting.
AGATA,"We must honour our service to each other. We must represent it. Just as the feet of the disciples were washed by Jesus at the Last Supper, knowing that his hour had come."
AUTJE,Stop. You’re tickling me.
NEITJE,God bless you.
AUGUST,"At this moment in time, most of the men are gone from the colony. All of the able bodied men, excluding those in wheelchairs, the elderly, and me, the schoolteacher, left yesterday for the city to post bail for the imprisoned attackers, leaving the women free to talk openly with one another."
PETERS,We will be back in two days.
AUGUST,"When they return, in 24 hours, the women will be given the opportunity to forgive these men, guaranteeing everyone’s place in heaven."
AUGUST,"My name is August Epp. Two months ago, I returned, from the outside world, to this colony, where I was raised. I am now the colony schoolteacher, and I have been asked to take the minutes of the meetings because the women are functionally illiterate, having had very little education."
AUGUST,"Ona Friesen asked me if I would take the minutes, and as I had nothing to do but kill myself, and as I have been in love with her for most of my life and would do anything for her, I agreed."
AUGUST,A vote was held earlier this morning.
AUGUST,"As the vote was tied between the option of Staying and Fighting or Leaving, representatives of two families of women, the Reimers and the Friesens, have been tasked with deciding whether or not to Stay and Fight or Leave, while the rest of the women tend to the work of the colony. They have invited representatives of the Janz family to be part of the conversation, though they voted to do nothing. They are meeting in Earnest Penner’s hayloft, as he is senile and rarely comes in."
SCARFACE JANZ,It is part of our faith to forgive. We have always forgiven those who have wronged us. Why not now?
SALOME,Because now we know better.
SCARFACE JANZ,Better than God? You know better than God?
ANNA,"Our Lord requires us to forgive, Salome. Or do you believe yourself mightier than he?"
SCARFACE JANZ,"We will be excommunicated, forced to leave the colony in disgrace, if we don’t forgive the men. And if we are excommunicated, we will forfeit our place in heaven."
HELENA,How could any of you live with the fear of that?
AGATA,What else are you afraid of Helena? Tell us. We want to hear.
HELENA,We can only do what we have learned.
GRETA,"Speak up, Helena. We can’t hear you."
HELENA,We have only domestic skills. How are we supposed to survive out in the World if we are excommunicated?
ANNA,We are unable to read or write. We’ve never even seen a map.
AGATA,These are all legitimate fears. How can we address them?
SALOME,"Shouldn’t we be concerned about more than just our survival, Helena? Is what we have lived, worth preserving?"
SCARFACE JANZ,These questions themselves are blasphemous.
GRETA,"Alright. No more blasphemous questions. I want to talk about my horses, Ruth and Cheryl."
GRETA,Alright. We’ll go.
GRETA,"When Ruth and Cheryl are frightened by Dueck’s Rottweilers on the mile road that leads to the church, their initial instinct is to bolt. These horses don’t organize meetings to decide what they will do. They run."
AGATA,"But Greta, we are not animals."
GRETA,We have been preyed upon like animals. Maybe we should respond like animals.
ONA,Do you mean run away?
SALOME,Or kill our attackers?
PETERS,Go. Go to the city. Get the police.
PETERS,For their own protection. These men need to be taken to jail in the city.
AGATA,In my lifetime I have seen horses confront angry dogs and try to stomp them to death. Animals don’t always flee their attackers. They can fight back and they can run away.
AGATA,"Either way, it’s a waste of time to try to establish whether we are animals. The men will be coming back from the city after they pay the bail for our attackers. Soon."
SCARFACE JANZ,The only important thing to establish is whether we forgive the men so that we are allowed to enter the gates of heaven.
MARICHE,"Laugh all you want, Salome. But we will be forced to leave the colony if we don’t forgive the men. And how will the Lord, when He arrives, find all the women if we aren’t in our colony?"
SALOME,"If Jesus is able to return to life, live for thousands of years and then drop down to earth from heaven, to scoop up his supporters, surely he’d also be able to locate a few women who-"
AGATA,Let’s stay on track-
SALOME,Alright. I’ll stay on track. I cannot forgive them. I will never forgive them.
MEJAL,I can’t either.
MARICHE,But we want to enter the gates of heaven when we die.
ONA,Are we asking ourselves what our priority is? To protect our children or to enter the kingdom of heaven?
MEJAL,No. That is not what we are asking. That is an exaggeration of what we are discussing.
ONA,"What are we discussing, then?"
AGATA,We will burn that bridge when we come to it.
SCARFACE JANZ,We have everything we want here.
SALOME,No.
SCARFACE JANZ,Want less.
SCARFACE JANZ,Does entering the kingdom of heaven mean nothing to any of you? After all we have suffered?
ANNA,Are you really willing to give up what we have always lived for?
ONA,"Surely there is something in this life worth living for, not only in the next."
SCARFACE JANZ,Are you abandoning your faith?
AGATA,We cannot stand by and do nothing when our children are harmed.
SCARFACE JANZ,How are you protecting your children from harm if you turn your back on God? And how will any of you survive? If you stay and fight you will lose. Or if you leave...
HELENA,Where will you go?
AGATA,All I know is that we cannot do nothing. By doing nothing we are not protecting our children who were given to us by God to protect and nurture.
SCARFACE JANZ,We will not be damned to hell with you.
AGATA,"That is your decision, and we must respect it."
AGATA,We must decide now whether we will stay and fight or leave. These are the options in front of us. We will not do nothing.
GRETA,I believe the only solution is to flee.
SALOME,Is this how we want to teach our daughters to defend themselves? By fleeing?
GRETA,"Not fleeing, but leaving. I am talking about leaving."
SALOME,I’d rather stand my ground and shoot each man in the heart and bury them in a pit than flee. And I’ll deal with God’s wrath if I have to!
ONA,"Salome. Aunt Greta is talking about leaving, not fleeing. The word “fleeing” wasn’t what they meant."
MARICHE,"Please forgive my mother for using the wrong word. It is a sin so outrageous, that Salome must take it upon herself to rectify for the sake of all humanity."
AGATA,“Leaving” and “fleeing” are different words. With different meanings. They each say something about us.
AGATA,August what do you make of all this? Do you have an opinion too?
AGATA,"Well, August?"
AUGUST,"I think... I think that it is possible to leave something or someone in one frame of mind and arrive elsewhere, in another entirely unexpected frame of mind."
MARICHE,We are already aware of this.
ONA,"We are aware of many things, in our hearts. But it is good, sometimes, to have them said out loud."
MEJAL,I want to stay and fight.
MARICHE,Won’t we lose the fight to the men and then be forced to forgive them anyway?
ONA,Is forgiveness that is forced upon us true forgiveness?
MARICHE,Autje!
MEJAL,Behave yourself. Can’t you hear the rafter creaking? Do you want the roof to cave in?
SALOME,I want to stay and fight too.
MARICHE,Of course you do. No one is surprised that you do. All you do is fight. Is this how we are to decide the fates of all of the women of this colony? Just another vote where we put an X next to our position? I thought we were here to do more than that.
SALOME,You mean talk more about forgiving the men and doing nothing?
MARICHE,Everything else is insane. But none of you will listen to reason.
SALOME,Why are you here then?! Why are you still here with us if that is what you believe?! Leave with the rest of the do-nothing women!
GRETA,She is my daughter and I want her here with us.
AGATA,I believe we are capable of hearing opinions other than our own. Or how can we expect anything to change?
AUTJE,This is never going to end.
NEITJE,We’ll be dead and they’ll still be talking.
AUTJE,Or worse. We might have to live through it.
ONA,August. I think you should make lists of the pros and cons for both options. Staying and Fighting or Leaving. And write large. Post it on the wall.
MEJAL,Why? We can’t read it.
ONA,No. But we will keep it here as an artifact for others to discover.
SALOME,Yes. A discovery.
ONA,"I think the first heading should read as follows. Staying and Fighting. Beneath that, write Pros."
AGATA,Who will go first?
AUGUST,Forgive me. Please excuse me. Forgive me. May I request that you take turns speaking so that I can understand what each of you is saying. It takes me a few seconds to transcribe...I’m a little behind here. I have to catch up.
MARICHE,Shall we put up our hands? As though we are children in your schoolhouse?
AUGUST,I apologize.
SALOME,We won’t have to leave.
AUGUST,Excuse me?
MARICHE,Write it down. Under pros. Salome has had a brilliant idea.
MARICHE,"“If we stay, we won’t have to leave.”"
NEITJE,We won’t have to pack.
MEJAL,We won’t have to figure out where we’re going or experience the uncertainty of not knowing where we are going. We don’t have a map.
SALOME,"That’s absurd. The only certainty we’ll know is uncertainty, no matter where we are."
ONA,Other than the certainty of the power of love.
SALOME,Keep nonsense like that to yourself. Please.
MEJAL,"Why couldn’t that be the case, that the only certainty is the power of love?"
SALOME,Because it’s meaningless! Especially in this fucking situation!
AGATA,Stop it. Now. I mean it.
MEJAL,That is disgusting. Truly.
AGATA,Neitje? Autje? Do you have something to add to the list?
NEITJE,We won’t have to leave the people we love?
GRETA,We could bring loved ones with us if we leave.
MEJAL,How? What does that mean? We move the whole colony? What can that possibly mean?
ONA,Several of the people we love are people we also fear.
AGATA,"We could create the possibility of a new order right here, in a place that is familiar to us."
SALOME,Not simply familiar. A place that is ours.
MEJAL,Do we need to write the cons? Isn’t it obvious that we must stay and fight?
GRETA,Cons. We won’t be forgiven.
MARICHE,We don’t know how to fight.
SALOME,I know how to fight.
MARICHE,We don’t want to fight.
GRETA,There is the risk that conditions will be worse after fighting than before.
ONA,May I speak?
AUGUST,Please.
ONA,"Would it be a good idea, before we list the pros and cons of staying and fighting, to talk about exactly what we are fighting for?"
SALOME,It’s obvious: we’re fighting for our safety and for our freedom from attacks!
ONA,"Yes. But what would that mean to us? Perhaps we need a statement which describes what we want the colony to be like after winning the fight. Perhaps we need to know more about what we are fighting to achieve, not only what we are fighting to destroy."
MARICHE,Why don’t we talk about reality instead?
AGATA,Because our reality is an old one. And we are talking about creating a new reality.
NEITJE,Are we staying or going?
AGATA,Ona. Please tell us more about the statement you are thinking about.
ONA,"Men and women will make all decisions for the colony collectively. Women will be allowed to think. Girls will be taught to read and write. The schoolhouse must display a map of the world so that we can begin to understand our place in it. A new religion, taken from the old but focused on love, will be created by the women of the colony."
ONA,Our children will be safe.
GRETA,“Collectively.” You sound like August’s mother.
MARICHE,Ona. You are a dreamer.
ONA,We are women without a voice. We have nothing to return to. Even the animals of the colony are safer in their homes than we women are. All we have are our dreams. So of course we are dreamers.
MARICHE,"Would you like to hear my dream? I dream that people who speak nonsense, who have no grasp on reality, are not put in charge of making statements!"
AGATA,"The statement Ona described sounds good to me. We can add to it over time. For now, it will declare what we women see as the future of the colony, whether we are here or elsewhere. Are we agreed?"
GRETA,What will happen if the men refuse to meet our demands?
ONA,We will kill them.
AGATA,No. Ona. No.
AGATA,She is only joking.
SALOME,Maybe not.
MARICHE,What if the men who are in prison are not guilty?
AUTJE,Mother?
MARICHE,"Yes I know, Autje."
AUTJE,Then why are you asking-
NEITJE,We caught one of them. I saw him.
ONA,Only one.
SALOME,Yes. Only one. But he named the others.
MARICHE,But what if he was lying?
SALOME,But the point-
MARICHE,We must consider this.
SALOME,"No! That is not our responsibility! Because we aren’t in charge of whether or not they are punished. We know that we’ve been attacked by men and not by ghosts or Satan as we were led to believe for so long. We know we have not imagined these attacks, that we were made unconscious with cow tranquilizer. We know that we are bruised and infected and pregnant and terrified and insane and some of us are dead. We know that we must protect our children. Regardless of who is guilty!"
AGATA,"Alright, Salome, thank you, please sit down."
AGATA,Shall we move on?
MARICHE,"But if there is any chance that the men in prison are innocent, shouldn’t we be joining forces to secure their freedom?"
ONA,It is possible that the men in prison are not guilty of the attacks. But are they guilty of not stopping the attacks? Are they guilty of knowing about the attacks and doing nothing?
MARICHE,How should we know what they’re guilty of or not?
ONA,But we do know. We do know that the conditions have been created by men and that these attacks have been made possible because of the circumstances of the colony. And those circumstances have been created and ordained by the men.
MARICHE,"But wait, aren’t you suggesting that the attackers are as much victims as the victims of the attacks? That all of us, men and women, are victims of the circumstances from which the colony has been created?"
ONA,"In a sense, yes."
MARICHE,"So then, even if the court finds them guilty or innocent, they are, after all, innocent?"
ONA,"Yes, I would say so."
MEJAL,The elders called them evil.
ONA,But that’s not true.
SALOME,It’s the elder’s quest for power that is responsible.
ONA,Yes because they needed to have those-
SALOME,Those they’d have power over.
MEJAL,And those people are us.
AGATA,And they have taught this lesson of power to the boys and men of the colony and the boys and men have been excellent students.
MEJAL,But don’t we all want some type of power?
ONA,"Yes, I think so. But I’m not sure."
AGATA,The only thing we can be sure of is that time is disappearing.
AUTJE,But... we caught them. We caught them.
SALOME,Yes.
MARICHE,Yes you did.
AUTJE,Then why are you making it so complicated?
NEITJE,"It’s very, very boring."
ONA,We could ask the men to leave.
MEJAL,Is that a joke?
SALOME,"Are you crazy, Ona?"
AGATA,"No, no..."
GRETA,Ask the men to leave?!
AGATA,"None of us have ever asked the men for anything. Not a single thing, not even for the salt to be passed, not even for a penny or a moment alone or to take the washing in or to open a curtain or to go easy on the small yearlings or to put your hand on the small of my back as I try, again, for the twelfth or thirteenth time, to push a baby out of my body. Isn’t it interesting, that the one and only request we women would have of the men would be to leave?"
AGATA,It’s not an option. They wouldn’t leave.
GRETA,Asking the men to leave is not an option. I’d like you to imagine Ruth and Cheryl-
AGATA,"Oh no, not again."
ONA,Please stop. I’m afraid I’ll go into labour!
MARICHE,Look! August is still taking the minutes!
AGATA,You must think we’re all lunatics.
AUGUST,"I don’t. And it doesn’t matter what I think, anyway."
ONA,Do you think that’s true? That it doesn’t matter what you think?
ONA,How would you feel if in your entire lifetime it had never mattered what you thought?
AUGUST,But I’m not here to think. I’m here to take the minutes of your meeting.
ONA,"But if, in all your life, you truly felt that it didn’t matter what you thought, how would that make you feel?"
ONA,"When we have liberated ourselves, we will have to ask ourselves who we are."
SALOME,Will we be done by suppertime? I have to give little Miep her antibiotics.
GRETA,Where did you get antibiotics?
AGATA,She walked. She walked for a day and a half to the mobile klinic. With Miep on her back.
AGATA,"The Lord is gracious and compassionate, slow to anger, rich in loving kindness and forgiveness."
SALOME,I have to hide the antibiotics in Miep’s apple sauce or she won’t swallow them.
AGATA,"The Lord is gracious and compassionate, slow to anger, rich in loving kindness and forgiveness."
GRETA,"The Lord is gracious and compassionate, slow to anger, rich in loving kindness and forgiveness."
GRETA,I’m not crying. I’m moisturizing.
THE WOMEN,"Work, for the night is coming, Work, through the morning hours; Work, while the dew is sparkling, Work ‘mid springing flowers;"
GRETA,Forgive me. They are too big for my mouth.
AGATA,Well. Let’s take a break.
MEJAL,Don’t say a word about my smoking. Honestly.
AUTJE,Is she always going to be like this now?
MEJAL,Like what?
AUTJE,Like a man. Is Nettie always going to be a man now?
MEJAL,I think she always felt she wasn’t a woman. What happened to her just made it...final.
NEITJE,Is my brother listening?
MELVIN,Is my brother listening?
MAN,He is.
NEITJE,"Hello, little brother. I don’t know if it was your baby or one of your friends. But I think it was likely yours. Because there was something wrong with it. Small as a bun, but with everything intact. I loved it, I think. Isn’t that strange? I won’t speak of it... or anything else. Ever again."
MELVIN,"Hello, little brother. I don’t know if it was your baby or one of your friends. But I think it was likely yours. Because there was something wrong with it. Small as a bun, but with everything intact. I loved it, I think. Isn’t that strange? I won’t speak of it... or anything else. Ever again."
AUTJE,But…
MEJAL,But what?
AUTJE,She doesn’t speak anymore.
MEJAL,She speaks to the children. I think they call her Melvin.
MEJAL,I mean it. Not one word about my smoking.
AUGUST,"You know, during the second world war, in Italy, civilians would hide in bomb shelters. Volunteers were needed to power the generators that provided electricity. They rode bikes. When you were swinging from the rafter earlier, it reminded me of this. You would have been the perfect volunteer. If we were in a bomb shelter."
AUTJE,Where would I ride the bike to in such a small space?
AUGUST,"Ah yes. Well, the bike would be stationary."
AUTJE,I have to get the water to the yearlings.
AUTJE,Watch this.
AUTJE,I’ll bet you didn’t learn how to do things like that when you went to University.
AUTJE,Only facts about stationary bicycles in far off places.
AUTJE,I suppose I shouldn’t be too sad then. That I won’t ever go.
AUTJE,Why were you forced to leave?
AUGUST,My mother questioned things.
AUTJE,She questioned God?
AUGUST,Not God. Power. The rules that are made in the name of God. She encouraged others to question things too.
AUTJE,Like Aunt Ona?
AUGUST,Yes. Ona knew her well.
AUTJE,Did she die?
AUGUST,"But sometimes, listening to all of you speaking today, I can hear her so clearly."
AUTJE,Why did the elders let you come back?
AUGUST,I went to university. So I could serve a purpose and teach the boys.
AUTJE,Too late.
AUGUST,I want to help. And I don’t know how.
AUTJE,You came back for Aunt Ona didn’t you? The way you look at her is... funny. I don’t know why she won’t just marry you. You both say so much that doesn’t make sense.
LOUDSPEAKER,I am here to collect data for the 2010 census.
LOUDSPEAKER,I am here to collect data for the 2010 census. All residents must come out of their homes to be counted.
SALOME,Where is Autje?
AGATA,Well. We must begin without her.
SALOME,Were you smoking?
MEJAL,Is that any of your business?
GRETA,Please.
AGATA,We must decide this afternoon about staying or leaving.
AUTJE,I can’t live a second longer! Life is too cruel!
MARICHE,Autje! Wait until I get ahold of you!
GRETA,I could have had a heart attack!
AUTJE,Excuse me. Excuse me. The Census taker just told us that one of our men is planning to return late tonight. He is coming to get some old horses to auction.
GRETA,Ruth and Cheryl!
NEITJE,They need more bail money for the attackers.
MARICHE,Tonight?
MARICHE,Which man?
AUTJE,Father.
MARICHE,Your Klaas.
MARICHE,Oh.
AGATA,So. Time is of the essence. Everyone get back to your seats.
MARICHE,Are you trying to call us to order?
AUGUST,No. No. Please forgive me.
MARICHE,Why are you here? Why is my presence questioned when there is a man-
GRETA,Pros for leaving:
MEJAL,We will be gone?
GRETA,We will be safe.
MARICHE,"Perhaps not. But the first is most definitely a fact, that if we leave we will be gone."
MARICHE,Do we really have time to state the obvious over and over?
GRETA,"Add to the list this: We will not be asked to forgive the men, because we will not be here to hear the question."
AGATA,Yes. Autje?
AUTJE,We will see a bit of the world?
AUGUST,Let’s move on to the Cons of Leaving.
MARICHE,"We, the women, will decide what happens in these meetings. Not a two-bit failed farmer who must teach. You have been invited here. You have been invited here to listen to what we have to say and to write it down. Nothing more. Just. Listen."
GRETA,"Mariche! Klaas is returning soon and you are wasting time! Klaas will return to your home for just long enough to take his animals in order to sell for bail money that will see the rapists return to the colony and he will lay his hands on you and on your children, and you, as always, do nothing but fire away at us all like a Gatling gun with your misdirected rage. What good does that do?"
AUGUST,I would like to apologize for wrongly attempting to nudge the proceedings. That is not my place.
GRETA,Mejal!
MEJAL,I'll stop.
NEITJE,We don’t have a map. We don’t know where to go.
AUTJE,We don’t even know where we are!
GRETA,Hush. Put your hair away.
MIEP,I hurt.
GRETA,There are no Cons of Leaving.
AGATA,"Not to worry, Nettie."
MARICHE,"If we do leave the colony, how will we live with the pain of not seeing our brothers and our sons again? The men?"
GRETA,"Time will heal. Our freedom and safety are the ultimate goals, and it is men who prevent us from achieving those goals."
MARICHE,But not all men.
ONA,"Perhaps not men, but a way of seeing the world, and us women, that has been allowed to take hold of men’s hearts and minds."
NEITJE,So if we leave... if we leave... I will never see my brothers again?
AUTJE,Who will take care of them? Of them all?
GRETA,We can’t know if we will stay or leave before we resolve these last- minute concerns.
ONA,I wouldn’t call the future of our relationships with the boys and men we love “last-minute concerns.”
ONA,I need some water.
ONA,"It’s good to have you with us, August. To remind us of what is possible. Because it’s easy to forget."
AUGUST,"I am so sorry, Ona."
ONA,"One day, I would like to hear those words from someone who should be saying them."
ONA,"Why does love... the absence of love, the end of love, the need for love, result in so much violence?"
AUGUST,Ona.
AUGUST,Ona. I could take care of you and your child. I want to. I-
ONA,I know August. You don’t have to say the words.
ONA,If I were married I would not be myself. And so the person you love would be gone.
AUGUST,Your child-
ONA,"If we stay and don’t win the fight, my child will be given to another family here. Maybe even to the family of my attacker. If we stay and we don’t win the fight."
AUGUST,You won’t let that happen.
ONA,No. No I won’t.
GRETA,"August. We want to discuss options for the men and the older boys, if the women decide to leave."
SALOME,Which is a waste of time because we are not leaving.
MARICHE,The men should be allowed to leave with the women if they wish.
MEJAL,Then what on earth is the point of us leaving?
