character,dialog
AGATA,"Melvin, please return to the children and play a game with them in the field next to the wash house. That is where the other women will find us, on their way out of the colony."
SALOME,Has Aaron readied the horses for us?
MELVIN,No.
SALOME,What? Where is he?
SALOME,Speak to me. Please. I won’t harm you. I am not your enemy!
AGATA,"You must calm down, Salome. Aaron will be found. Melvin. You are safe."
SALOME,But we’re leaving soon. I’m not leaving without him.
AGATA,Salome! Come back!
ONA,Salome! Aaron will be found. He will leave with us. I know he will!
ONA,But what if she doesn’t convince Aaron?
ONA,Mother?
AGATA,We are going to go now.
AUGUST,Now?
AGATA,"Yes. Make a list, August."
AUGUST,A list of what?
AGATA,"Of good things. Of memories, of plans. Whatever you feel goes into a good list; what we, the women, would want there, please write it down."
AGATA,"Thank you, August. For all you have done. We are all so proud of you. Your mother would be too."
AUGUST,I will make a list.
GRETA,This will be a difficult trip.
AGATA,I’m aware of that. Today is the day that the Lord hath made. Let us rejoice and be glad in it!
AGATA,I won’t be buried in this colony. Help me into a buggy now and I’ll die on the trail.
ONA,What about August?
AGATA,"August, wouldn’t you marry my Ona?"
AUGUST,I’ve asked her so many times.
AGATA,And she always said no?
AUGUST,Hang on with both hands.
AUGUST,What about Aaron?
AUGUST,Ona. I will always love you!
AGATA,"And she loves you too, August. She loves everyone."
AUGUST,"How will I live without these women? My heart will stop. I will try to teach the boys and men about these women, about the new reality of which they dream. I must make a list. A list, from the Middle English liste, meaning desire. Which is also the origin of the word “listen.”"
AGATA,Sun.
NEITJE,Stars.
MIEP,Pails.
AUTJE,Birth.
MARICHE,The Harvest.
MEJAL,Numbers.
ONA,Sounds. Window.
GRETA,Straw. Beams.
SALOME,Love.
SCARFACE JANZ,I will do what God commands me to do. I will not lie for you.
SALOME,Futility.
MELVIN,Language.
MIEP,Wind.
AGATA,Women.
SALOME,We may need to protect ourselves.
AUGUST,Where is Aaron?
SALOME,"He is in the buggy, waiting."
AUGUST,You convinced him to leave?
SALOME,Here. You may need this. For protection.
AUGUST,Did you have to-
SALOME,Yes. It’s just as though I had picked up a sleeping child in the night and carried him away from a house that was on fire.
AUGUST,Is it?
SALOME,He’s coming with me. He’s my child.
SALOME,I broke the rules? I did. I broke the new rules already. Maybe I’ve broken everything. And we haven’t yet begun. I sprayed Scarface Janz also. She was planning to go to the city to tell the men.
AUGUST,Does she know how to get there?
SALOME,"No, of course not."
AUGUST,So it was an idle threat.
SALOME,But I was afraid.
SALOME,"Klaas too. But he wasn’t awake yet, so he won’t remember being knocked out. Just like we didn’t."
SALOME,"Goodbye August, and good luck."
AUGUST,Please take care of Ona and her baby.
SALOME,Of course. I promise.
AUGUST,Wait. I need to give you something.
AUGUST,Here.
SALOME,"Why do you have a gun, August?"
AUGUST,Because...
SALOME,Don’t kill yourself August. You have important work to do.
SALOME,You are the boys teacher.
SALOME,We really have to hurry.
AUGUST,But you’re not fleeing.
SALOME,That’s right. We’ve chosen to leave.
AUGUST,But not Aaron.
SALOME,I will have to live with that.
AUGUST,"Don’t come back. Don’t ever come back, any of you."
SALOME,I’ll miss you. Be a good teacher. You have straw in your hair.
AUGUST,Wait! I have to give you the minutes!
SALOME,August! I have to go!
AUGUST,Please give these to Ona.
SALOME,But she can’t read them.
AUGUST,Her child will read them.
SALOME,August. The purpose was for you to take the minutes.
SALOME,We’ll meet again.
AUGUST,We’ll meet again.
