character,dialog
MONK,My problem is that books like this aren’t real. They flatten our lives.
CORALINE,What do you mean?
MONK,"I mean that my life is a disaster, but not in the way you’d think reading this shit. Books like this reduce us, and they do it over and over again, because too many white people -- and people, apparently, like you-- devour this slop like pigs at a dumpster to stay current at fucking cocktail parties or whatever."
CORALINE,You’ve got a lot of opinions for someone who hasn’t published anything for years.
MONK,And you’ve published what exactly?
CORALINE,"Okay, what is wrong with you? Why are you acting like this?"
MONK,I’m not acting like anything.
CORALINE,"You’ve been acting like a weirdo for weeks. You’re obfuscating and sneaking around. You’re fucking unknowable. And maybe you think being an enigma is chic and artsy, but I think it just makes you an asshole."
MONK,"Well, um, you don’t understand my life, and you can’t, so just leave it at that."
CORALINE,One day maybe you’ll learn that not being able to relate to other people isn’t a badge of honor. I think you should leave.
MONK,Well you know what I think?
CORALINE,"You should leave, Monk."
MONK,Nonsense...
MONK,You guys need any help with that?
BURT,"Nah, we’re good."
MONK,Thought you could use a little brawn.
JEFF,We got it.
LORRAINE,"Mr. Monk, you mind if I keep the soda maker? You don’t like bubbly water anyhow, right?"
MONK,It’s all yours.
LORRAINE,Thank you.
MONK,"Hey, what about this?"
LORRAINE,No. I always hated that color. It’s just the one your father bought.
MAYNARD,"Thelonious, this just came for you, Monk."
MONK,"OK, thanks."
LORRAINE,This is the last of it.
LORRAINE,"Goodbye, Mr. Monk."
MONK,"Goodbye, Lorraine."
MONK,Drive safe. Guess I’ll see you at the wedding.
MAYNARD,Alright.
WILSON,Thompson-Watt apparently raced to publish it.
AILENE,"Yeah, I heard that they ran 300,000 copies already. And they’re reprinting more soon. I mean, it’s going like gangbusters."
DANIEL,Christ on a crutch. It better be good.
WILSON,I heard the writer’s a fugitive.
DANIEL,That would explain the title. He didn’t go to charm school.
AILENE,I think that background is a plus. I am thrilled to read a BIPOC man hurt by our carceral state.
DANIEL,Wait -- are you one of those “defund the cops” nuts?
AILENE,Yes. And I wouldn’t expect you to understand.
DANIEL,"Well, I hope someone you love doesn’t ever get raped or murdered."
SINTARA,"Can we not have this conversation now, please?"
MONK,"Look, criminal or not, I don’t think we should add it. We’re already weeks into the process, and I don’t know about any of you, but I’ve got more than a dozen books that haven’t even opened yet."
AILENE,It was published within the submission window. I think we have to accept it.
WILSON,"It’s just one more. And from the looks of it, it should be a quick read."
DANIEL,"A quick “Fuck,” huh? I’ve had some of those."
AILENE,"Bye, guys. Bye."
AGNES,"Hi, Monkey."
MONK,You look beautiful.
KENNY,"Oh, hello!"
AGNES,"Monkey, do we know these men?"
MONK,"No, mother. This isn’t the Alzheimer’s. These are actual strangers. Who are you people?"
KENNY,We’re Cliff’s friends.
MONK,Of course you are.
KENNY,We met him a few days ago. I’m Kenny. This is Alvin.
ALVIN,Are you Monk?
MONK,I am. How did you know?
ALVIN,Well Cliff said Monk is a real tight-ass.
MONK,"Oh, did he? Delightful. Mother, you sit here. Lorraine?"
CLIFF,What the hell are you doing here?
MONK,You first.
CLIFF,Shit. The wedding.
MONK,Yeah.
CLIFF,"Oh, fuck. I didn’t go to the airport that day. I needed some time to myself."
MONK,Time to oneself implies -- by definition -- time alone.
CLIFF,"Christ, here we go. Detective Dictionary."
LORRAINE,"Oh, Mr. Cliff..."
MONK,"I’m sorry, guys. I’ll handle it. You need to leave. Don’t bother to clean up. Just go."
MAYNARD,"No, it’s alright."
CLIFF,"It’s good to see you, too, Maynard. But I don’t want to impose."
LORRAINE,You can’t impose. You’re family.
CLIFF,OK. Let me clean up a bit. Congratulations.
KENNY,Can we make y’all some breakfast? I can whip up a killer smoothie and Alvin used to work the omelette station on a cruise ship.
LORRAINE,That sounds lovely. Thank you.
MONK,It’s very kind of you to let them stay.
MAYNARD,It’s easier to deal with other people’s families than your own.
MONK,"I regret to inform you that in a couple hours, this will be your family."
CLIFF,Did you piss her off?
MONK,Yeah.
CLIFF,Did you shut her out?
MONK,Yeah.
CLIFF,"Dad shut everyone out, too. And lied all the time. Look how that turned out."
MONK,"I find myself getting very angry these days, like dad."
CLIFF,These days?
CLIFF,I’ve been thinking lately about how dad died not knowing I’m gay.
MONK,I think he suspected it.
CLIFF,He may have. But he didn’t know for sure. He never knew the entirety of me. And now he never will. That makes me real sad.
MONK,"Well, what if he had known and rejected you?"
CLIFF,"At least he’d be rejecting the real me. I know that sounds crazy, but there’d be some relief in that."
MONK,It doesn’t sound so crazy.
CLIFF,"People want to love you, Monk. I personally don’t know what they see in you, but they want to love you."
CLIFF,You should let them love all of you.
DANIEL,"It was dog shit. I mean, some mollycoddled chump faffing on and on about his dead mom. Who cares?"
WILSON,"OK, so that means that “Bury Me Standing” is fourth. Let’s talk about “Fuck.”"
MONK,Could we not?
AILENE,"Personally, I adored it. It was like gazing into an open wound."
WILSON,"I agree. I think it’s the strongest African American novel I’ve read in a long time -- since yours, of course, Sintara."
DANIEL,"I actually liked it much more than I was expecting. I mean, this is a gutsy piece of work. And necessary for the times."
AILENE,"What did you think, Sintara?"
SINTARA,"I found it to be pretty pandering, actually."
MONK,You did?
SINTARA,Yes. Did you not?
MONK,I very much did. I thought it was simplistic and meaningless.
DANIEL,Of course it’s simplistic -- it’s the language of the gutter. Not some prissy graduate thesis.
MONK,Language of the gutter? Jesus Christ.
WILSON,I think our blood sugar’s low. How about we take a break for lunch?
SINTARA,Fine by me.
MONK,I’m sorry.
SINTARA,"Oh, no, you’re fine."
MONK,I’m not interrupting?
SINTARA,No.
MONK,Do you mind if I ask you something?
SINTARA,Sure.
MONK,Um...what about “Fuck” did you find pandering?
SINTARA,"Oh. I can’t really put my finger on it, but...it’s not different from some of what’s out there, but it just felt...”soulless” is the word that I’m gonna use? You said you agreed, right?"
MONK,I do. I think it seems written to satisfy the tastes of guilt-ridden white people.
SINTARA,"Yeah, the kind of book critics will call “important” and “necessary” but not “well-written.”"
MONK,Exactly.
SINTARA,Is that what this is about? You think my book’s trash.
MONK,"No. To be honest, I haven’t read your book. I’ve read excerpts, and it didn’t seem so dissimilar."
SINTARA,I did a lot of research for my book. Some of it was actually taken from real interviews. Maybe you’ve been up in your ivory tower of academia for so long you’ve forgotten that some people’s lives are hard.
MONK,"Your life? You went to an exclusive, bohemian college. You had a job at a fancy publishing house in New York."
SINTARA,So what? I don’t need to write about my life. I write about what interests people.
MONK,You write what interests white publishers fiending black trauma porn.
SINTARA,They’re the ones buying the manuscripts. Is it bad to cater to their tastes?
MONK,If you’re OK feeding people’s base desires for profit...
SINTARA,I’m OK with giving the market what it wants.
MONK,That’s how drug dealers excuse themselves.
SINTARA,And I think drugs should be legal.
MONK,"But you-- you’re not fed up with it? Black people in poverty, black people rapping, black people as slaves, black people murdered by the police, whole soaring narratives about black folks in dire circumstances who still manage to maintain their dignity before they die-- I mean, I’m not saying these things aren’t real, but we’re also more than this. And it’s like so many writers like you can’t envision us without some white boot on our necks."
SINTARA,Do you get angry at Bret Easton Ellis or Charles Bukowski for writing about the downtrodden? Or is your ire strictly reserved for black women?
MONK,Nobody reads Bukowski thinking his is the definitive white experience. But people -- white people -- read your book and confine us to it. They think that we’re all like that.
SINTARA,"Then it sounds like your issue is with white people, Monk, not me."
MONK,"That may be, but I also think that I see the unrealized potential of black people in this country."
SINTARA,Potential is what people see when they think what’s in front of them isn’t good enough.
AILENE,"So, what are we talking about?"
AILENE,We’re starting again.
MONK,I’ll be right there.
MONK,"Yeah, can I speak to Arthur? Yeah, it’s Monk. Hey, I’m fine. Listen, you think you can set up another meeting with Wiley? I’ve got a new idea for him. For a different kind of movie."
AILENE,I think it’s “Fuck” for me.
DANIEL,Me too.
WILSON,I agree.
SINTARA,I disagree. I’m sorry.
MONK,I think it would be a mistake to award this book anything at all.
DANIEL,"Well, it’s two versus three, so “Fuck” is the winner."
AILENE,"“Fuck” is the winner. You know, it’s not just that it’s so affecting. I just think it’s essential to listen to black voices right now."
MONK,Mother.
MONK,Did you know dad was cheating on you?
AGNES,He was bad at keeping secrets.
MONK,Why didn’t you leave him?
AGNES,He would have been even more lonely without me.
MONK,You thought he was lonely?
AGNES,"Your father was a genius. Geniuses are lonely, because they can’t connect with the rest of us. You’re a genius, son."
MONK,I certainly don’t feel like one half the time.
AGNES,"That’s because you’ve always been so hard on yourself, Cliffy."
CARL,"And now, the final award of the evening. I promise to leave you alone and let you eat after this."
CARL,"But, before I announce the winner, I would like to acknowledge our group of judges -- our incredibly diverse group of judges -- who’ve sacrificed valuable time so we can all celebrate here tonight. So if you could your hands together -- they did a fantastic job."
CARL,"OK, without further ado: this year’s Literary Award goes to -- oh, I knew it: By Stagg R. Leigh, ”Fuck”!"
CARL,I’m not sure if Mr. Leigh is going to grace us with his presence tonight. He’s famously cagy about attention.
CARL,"Hold on, OK, I see some-- someone’s coming."
CARL,"Oh, uh, Thelonious Ellison one of our judges...weirdly walking toward the stage...no idea why. Hey, what’s going on?"
MONK,Excuse me.
MONK,I have a confession to make.
WILEY,"Wait, wait, wait. Smash to black? No fucking way, dude."
MONK,What’s wrong with that?
WILEY,There's no resolution here. What's he gonna say?
MONK,I don't know. I think that's what's interesting about it.
WILEY,He should say something. What did you say?
MONK,Nothing. I walked out of the ceremony and the next day I called you to say I wanted to write this movie.
WILEY,"Well, Monk the character should say something."
MONK,I don't want him to do some grandiose speech spoon-feeding everyone the moral of the story. There is no moral. That’s the idea. I like the ambiguity.
WILEY,"OK, look. You're a good writer, and this is almost there. But novels aren’t movies, OK? Nuance doesn't put asses into theater seats. We need a big finish."
WILEY,What is this?
ASSISTANT,It’s the seltzer you asked for.
WILEY,Why's it all wet?
ASSISTANT,Condensation?
WILEY,Condensation? You a fucking weatherman now? You want anything?
MONK,"No, I'm fine. Thank you."
WILEY,This is Monk. We're gonna make a movie with him if he can get the ending right.
ASSISTANT,Nice meeting you.
MONK,You as well.
WILEY,Get me a flat white. And hey: Never again.
WILEY,"Alright, what other endings you got in that big brain of yours?"
MONK,How about if --
CARL,"This year’s Literary Award goes to - - Stagg R. Leigh, ”Fuck”!"
MONK,I’d like to apologize. I haven’t been myself lately.
MONK,What about that?
WILEY,Will she forgive him?
MONK,Dunno. The real Coraline won’t return my calls. Maybe the movie Coraline is more forgiving.
WILEY,"No, it's too pat. Makes the whole thing feel like a rom-com. We don't wanna make a rom-com. We wanna make something real. Give me something real."
MONK,"I mean, we could just --"
CARL,"Hey, what’s going on?"
MONK,Excuse me.
MONK,Beat it.
MONK,I have a confession to make.
DETECTIVE,Stagg Leigh! On the ground! Now!
MONK,What?! No! I’m not Stagg R. Leigh! He doesn’t exist. I’m Monk! Thelonious Ellison!
DETECTIVE,You’re a fugitive! On the ground now!
MONK,"No, that was all a marketing gimmick! It was all lies!"
UNIFORMED COP,He’s got a gun!
WILEY,"He’s dead? They smoke him? It’s perfect. Yes! That is perfect. Time to pick out your tux, my brother."
MONK,Fuck.
CLIFF,"So, are they gonna make your movie or what?"
MONK,Unfortunately yes.
CLIFF,Ay! You know what? Good luck finding someone handsome enough to play me.
MONK,I think they have.
CLIFF,Who they got?
MONK,Tyler Perry.
