character,dialog
MONK,"The best one nearby is $5,600 a month. And that’s for a shared room. It goes up to $6,900 a month for a private room."
CLIFF,Why are you looking at the best one? She wasn’t the best mother.
MONK,I’m not calling to re-litigate our childhoods.
CLIFF,Of course not. ‘Cause yours was great.
MONK,"Goddamnit. Are you going to help me, or not?"
CLIFF,Won’t Medicaid cover it or something?
MONK,That’s not how it works. You don’t know this?
CLIFF,"Oh, hello."
MONK,Who’s that? What are you doing?
CLIFF,I’ve taken a lover.
MONK,You’ve “taken a lover”?
CLIFF,"Yeah. Do you have a problem with that, homophobe?"
MONK,"Listen, I’m not offended that you’ve taken a lover, Cliff. I’m offended, Cliff, that you call it taking a lover."
CLIFF,"You can eat shit, Nigga."
CLIFF,"I’ll take my lover right now. Hey, where you goin’?"
ARTHUR,There you are.
MONK,Traffic was insane. What’s up?
ARTHUR,Sit down.
ARTHUR,We sold your book.
MONK,Holy shit. I thought it was DOA.
ARTHUR,Not “The Persians.”
MONK,No. Get out.
ARTHUR,"Paula Baderman, from Thompson-Watt."
MONK,She always passes.
ARTHUR,"Not this time. They want to pre- empt for $750,000."
MONK,No one’s ever offered that much to me.
ARTHUR,This is you.
MONK,"No it’s not, Arthur."
ARTHUR,You wrote it.
MONK,As a joke.
ARTHUR,"Well, now it’s the most lucrative joke you’ve ever told."
MONK,And I’m not selling.
ARTHUR,Why not?
MONK,"Because it’s trash, Arthur. You didn’t even want to send it out the other day. But look who’s suddenly overcome his fears."
ARTHUR,I know. I broke the first rule of sales: Never underestimate how stupid everyone is.
MONK,"Well, I’m not participating in making them any stupider."
ARTHUR,"Well, you haven’t...thus far, which is admirable. But you also haven’t made any money. Doesn’t your mom need help these days?"
ARTHUR,Check this out.
MONK,"I don’t care how drunk we get, I’m not selling it."
ARTHUR,That’s not what I’m doing.
ARTHUR,"Johnnie Walker Red, twenty-four bucks. Johnnie Walker Black, fifty bucks. Johnnie Walker Blue, one- hundred-and-sixty dollars. You see the metaphor?"
MONK,No.
ARTHUR,"These are all made by the same company. The Red is shit, the Black is less shit, and the Blue is good. But fewer people buy the Blue, because it’s expensive, and at the end of the day, most people just want to get drunk. For most of your career, your books have been Blue -- they’re good, they’re complex, but they’re not popular, because most people want something easy. Now, for the first time ever, you’ve written a Red book. It’s simple, prurient. It’s not great literature, but it satisfies an urge, and that’s valuable. What I’m trying to illustrate is that just because you do Red doesn’t mean you can’t also do Blue. You can do it all, like Johnnie Walker. In fact, you’ve got Johnnie Walker beat, because you don’t even have to put your real name on it."
MONK,Jesus. Do we drink now?
PAULA,Hello?
ARTHUR,"Hello, Paula."
PAULA,Arthur! So wonderful to hear from you. I hope you’re with the man of the hour.
ARTHUR,I am indeed. He’s right here next to me.
PAULA,Mr. Leigh?
MONK,This is he.
PAULA, Oh...really?
MONK,"Yeah, goddamnit. Motherfucker!"
PAULA,"Oh, OK. I was a little confused at first, but--"
ARTHUR,We’re both very excited to discuss Thompson-Watt’s offer.
PAULA,"Yes. Well, first, let me say that all of us here at Thompson-Watt are thrilled with “My Pafology."" It is about as perfect a book as I’ve seen in a long, long while -- just raw, and real. Mr. Leigh, is this based on your actual life?"
MONK,Yeah. You think some bitch-ass college boy can come up with this shit?
PAULA,"No, no, I don’t. You know, that kind of visceral energy cannot be taught, right? Stagg, may I call you -- now is Stagg a pseudonym?"
ARTHUR,"Yes, uh, it is. Mr. Leigh can’t use his real name because he’s a...well, he’s a wanted fugitive."
PAULA,Oh my god. Wow.
ARTHUR,That’s why this couldn’t be a video conference.
MONK,Are you crazy? What if they fact check this?
ARTHUR,Fact check? There’s barely money to pay editors anymore. Just go with it.
MONK,"Uh, yeah, I did a, uh...a twelve year bid, but no goin’ back. Nah mean?"
PAULA,"Yeah. Yeah. You know, um, I’ve been reading a lot about the prison abolition movement--"
MONK,Oh god...
ARTHUR,"I’m sorry to rush, Paula, but can we talk business? Mr. Leigh values his time outside of a cell."
PAULA,"Of course. I’m sure you’re both busy, so I’ll get right to it. You’ll notice that our offer is unusually large. And that is because we think Mr. Leigh has written a best-seller. We think this is going to be the read of the summer."
MONK,"Yeah, I’m sure white people on the Hamptons will delight in it."
PAULA,"Yes, we will. Th--they--we?...it’s gonna be huge. Huge. I love it."
MAYNARD,Is that little Thelonious Ellison?
MONK,My god. Maynard.
MAYNARD,Everyone still call you Monk?
MONK,"Well, everyone but you."
MAYNARD,Thelonious is a beautiful name. Seems sinful to not say it whole.
MONK,"Well, I’m happy somebody appreciates it."
MAYNARD,I heard about your sister. My condolences.
MONK,Thank you.
MAYNARD,I don’t think I’ve seen you since before your father passed.
MONK,"Yeah, it’s been a while. I live in LA now."
MAYNARD,"Hollywood! Hey, do you write for that NCIS?"
MONK,Just books.
MAYNARD,Well you should try to write for NCIS. It’s popular.
MONK,"Well, maybe I will. So, how you been?"
MAYNARD,"Oh, I’m good. And you?"
LORRAINE,Mr. Monk!
LORRAINE,What would you like for dinner?
LORRAINE,Maynard.
MAYNARD,"Hi, Lorraine. It’s been a dog’s age."
LORRAINE,"Well, I guess it has. You look well."
MAYNARD,"You too. Well, I best be getting back. Good to see you, Thelonious."
MONK,You too.
MAYNARD,Lorraine.
LORRAINE,Ain’t nothing to smile at.
MONK,There she is. Behave yourself.
CORALINE,Hi.
CORALINE,Got this for you.
MONK,"Thank you. Lorraine, this is Coraline."
LORRAINE,Welcome.
CORALINE,Hello.
MONK,"Oh, mother. Perfect timing. This is Coraline."
AGNES,"Hello, dear. I’m Agnes."
CORALINE,Such a pleasure to meet you. I brought you these.
AGNES,Dahlias are my favorite. There’s a whole world inside them.
AGNES,Lorraine.
MONK,"Mother, you sit here..."
MONK,"Alright. And Coraline, why don’t you sit across from mother?"
AGNES,I’m happy you’re not white.
CORALINE,Me too.
MONK,"...yeah, it was pretty funny. I think you remind her of my sister."
CORALINE,"Hmm. Well, do you think we look alike?"
MONK,"No, but you’re both self-assured, and funny, and you’re both...fantastic kissers."
MONK,What’s wrong?
LORRAINE,I’d just stepped out for a moment to have a cup of coffee with Maynard. I was right in front.
MONK,Where’s Mother?
LORRAINE,I don’t know. The back door was open. She’s gone.
MONK,What?
MAYNARD,We should split up. Here. I’ve got more in the car.
MONK,Mother! Mother!
MONK,Mother! Hey! Mother!
MONK,Hey! Hey! Stop! Hey!
MONK,Where are you going?
AGNES,Lisa’s out there! Roughhousing with the cousins. Somebody’s going to get hurt.
MONK,"Stop! I will go tell her, OK?"
AGNES,"Yeah, but they--"
MONK,"I will take you back to the house, and then I will go tell her."
AGNES,But they’re out there!
MONK,I know. I know.
AGNES,OK. You sure?
MONK,I will tell her.
AGNES,OK
MONK,C’mon. It’s too cold out there.
AGNES,Lisa doesn’t swim very well.
MONK,I know. OK. Almost there. Alright.
MONK,"Okay, Monkey."
LUZ,"And this is our library. It’s full of all the classics, and we try to get some new releases, too. Do you like to read, Mrs. Ellison?"
AGNES,No.
MONK,That’s not true. She loves to read. She taught me to love reading.
LUZ,Perhaps we can get some of your son’s books in here and you can lead a book club?
MONK,I’m sorry.
LUZ,"It’s fine. It’s hard for a lot of the residents at first, but she’ll settle in."
MONK,"Right. I appreciate all your help. But, uh, how soon do you think we get her in?"
LUZ,In about a month. You can start the paperwork today if you’d like.
MONK,Great. I’d like that.
LUZ,I’ll go check in on mom.
MONK,Hello?
CARL,"Hello, Thelonious. My name is Carl Brunt. I’m the director of the New England Book Association."
MONK,"Hi, Carl. I know who you are."
CARL,"Oh, good. Then perhaps you also know that each year my organization bestows the somewhat pretentiously named Literary Award."
MONK,"Every writer knows the Literary Award, Carl. Especially those of us who haven’t won it."
CARL,"Well, that’s related to why I’m calling. Like many American institutions, mine was recently rattled by the notion that our lack of diversity has led to a blindspot in our work. So we’re kind of trying to remedy that and, to that end, I was wondering how you might feel about being a judge for this year’s award."
MONK,"Um, let me say first say, Carl, that I’m honored you’d choose me out of all the black writers you could go to for fear of being called racist."
CARL,"Yeah, you’re very welcome."
MONK,But I think this sounds like a lot of work.
CARL,"Yeah, I can’t deny that. I mean, you’re going to have to read dozens of books. We could offer you a modest stipend."
MONK,"Even so, I’m not sure."
CARL,"OK. One other crass perk I reference when people are on the fence is that this will allow you the opportunity to literally judge other writers for once, rather than just figuratively."
MONK,Alright. I’m in.
CARL,Fantastic. OK. Great. So you’re going to be one of five judges. The only one we have confirmed so far is Sintara Golden. Are you familiar her work?
MONK,Vaguely.
LORRAINE,"I brought you lunch, Mr. Monk."
MONK,Wow. To what do I owe the pleasure?
LORRAINE,"Well, I have a favor to ask."
LORRAINE,I was wondering if I might be able to take the afternoon off. Maynard just came in from the beach and we thought it might be nice to visit a museum.
MONK,"Yes, of course. I’m free today, so I can look after Mother."
MONK,"Lorraine. You really like him, huh?"
LORRAINE,He’s a fine man.
MONK,Yeah?
ARTHUR,"The guests of honor! Hello, Mrs. Ellison. Looking beautiful as ever."
AGNES,"Hello, Arthur."
ARTHUR,"Layne, would you take Mrs. Ellison to the kitchen and set her up with some tea?"
LAYNE,"Right this way, ma’am."
MONK,"Mother, I won’t be long."
AGNES,Take your time.
ARTHUR,Not the pods! The good tea -- for guests!
ARTHUR,What is this? I told you to dress street.
MONK,I did.
ARTHUR,Fuckin’ Sesame Street.
MONK,What’s this guy’s name? Willy?
ARTHUR,Wiley. Wiley Valdespino. He specializes in Oscar-baity “issue” movies. He did the Middle Passage one last year.
MONK,Somehow I didn’t see that.
ARTHUR,"Of course not; you’re not lobotomized. But if he adapts your book, you stand to make a lot of money."
MONK,Why can’t we just do a phone call?
ARTHUR,"Well, he said if he’s going to cut a check this large then he needs to meet in person."
MONK,"Alright, what do I need to do?"
ARTHUR,"Just make him like you. When I talked to him, he seemed thrilled that you’re a fugitive. Just, you know, play that up."
MONK,What if he recognizes me?
ARTHUR,You?
MONK,Yeah. The real me.
ARTHUR,"Monk, you’re not that famous. And nobody in Hollywood reads. They get their assistants to read things and then summarize them. The whole town runs on book reports."
MONK,Are you sure you can look after my mother?
ARTHUR,She won’t leave my sight. You’ll just be across the street anyway. You should go. You’ll be late. He’s waiting for you.
MONK,Well...
MONK,"If he wants a stereotype, maybe it’s better I’m late."
WILEY,"Stagg, I presume."
MONK,That’s me.
WILEY,"Hey. I’m Wiley. Nice to meet you, brother."
WILEY,Sorry about the bourgie restaurant. My assistant picked it. We can go somewhere else if you’re uncomfortable.
MONK,This is fine.
WILEY,What’re you drinking?
MONK,I’ll have a chenin blanc.
MONK,Your driest.
WILEY,Ha.
MONK,What’s funny?
WILEY,Just a strange order for a guy like you.
MONK,Why’s that?
WILEY,Just don’t see too many convicts drinking white wine.
MONK,You know many convicts?
WILEY,"You’d be surprised. I spent a month in the joint myself. It was some interstate commerce shit. It was a short stay, but I’ll tell you what: That experience grounded me. The people I met in there allowed me to see a whole new world of underrepresented stories from underrepresented storytellers. Can I ask what you were in for?"
MONK,I don’t like to talk about that. You feel me?
WILEY,Was it murder?
MONK,"You said that, not me."
WILEY,"You know, I gotta tell you. Before you showed up, I was a little worried you might be a phony. A lot of fakes in Hollywood."
MONK,"Well, I’m not from Hollywood."
WILEY,"Yeah, no. That’s obvious. Clearly you’re cut from a different cloth than your average screenwriter. Let me ask you. I know they sent you some of my stuff. Did you have a chance to see any of my movies?"
MONK,"Sorry, sorry. What did you say?"
WILEY,Have you seen any of my movies?
MONK,"Uh, nah."
WILEY,"OK. Well, look. I like to pair genre with real-world pathos, which sort of elevates things. You might be interested in this new one we’re about to shoot, actually. It’s about this white couple. They get married on an old plantation in Louisiana and all the slave ghosts come back, and they murder everyone."
MONK,Dear god.
WILEY,"I know. It’s great, right? It’s called “Plantation Annihilation.” Ryan Reynolds gets decapitated with an Afro pick in the opening scene. He’s a friend."
MONK,I’ve got to go.
MONK,Mother! Mother!
ARTHUR,Some ad exec on the third floor had an aneurysm.
MONK,Awful.
ARTHUR,I know. Imagine exploding your brain trying to think up a toilet paper commercial.
MONK,I assume Wiley’s not interested. I sprinted out of there like a complete maniac.
ARTHUR,"Actually, he’s offering $4,000,000 for the rights."
MONK,What?
ARTHUR,"Yeah, man! He called you “the real deal."" Said that you took off the moment you heard police sirens."
MONK,"The dumber I behave, the richer I get."
ARTHUR,Now you know why my parents moved here from Puerto Rico.
WILSON,"I mean, we can’t be expected to read every novel all the way through, right?"
AILENE,What? No. People have worked hard on these books. We have to respect that.
WILSON,"Hard work doesn’t demand respect. You know, people worked hard on the Third Reich."
AILENE,"Well, I feel that we owe it to them to read every page."
DANIEL,"That is such horse shit. I mean, most of it’s going to be that Knausgård autofiction crap anyhow. I’ll tell you right now -- I’m not reading 600 pages about some pretentious jackwagon discovering masturbation. Sorry."
SINTARA,"OK. Look, I think we’re all experienced enough to assess the general quality of something within 100 pages. If you want to read beyond that, that’s your prerogative."
AILENE,"Well how do you feel, Monk?"
MONK,"Uh, I agree with Sintara, actually. I think 100 pages is sufficient."
DANIEL,"You know, this is all a crock, anyway. I mean, pitting art against other art for awards -- like it’s not subjective -- it’s absurd."
AILENE,Then why did you agree to be a judge if you feel that way?
DANIEL,"Well, because it’s either me or some other Brooklyn hack who doesn’t think there’s a world beyond the Hudson River, Ailene."
AILENE,"It’s the East River, if you’re in Brooklyn, Daniel."
SINTARA,"You know what? Art is subjective, but I think this is an opportunity to highlight books that might otherwise be undervalued. Book sales are plummeting right now, so perhaps this award can give someone a real chance at a career in this industry."
MONK,"Hear, hear."
MONK,"Where do you want this, Mother? I thought it it might look nice here, with this the natural light."
AGNES,"I don’t care. I never liked that painting, anyway."
MONK,"OK, well, I’ll bring some more things from home next week."
ORDERLY,"We’ve got your lunch ready for you, Mrs. Ellison."
CORALINE,This looks great. What is it?
ORDERLY,It’s roasted turkey and havarti on twelve grain.
CORALINE,Sounds delicious.
LORRAINE,"Mrs. Ellison prefers white bread. And she doesn’t like the crust. As much as this place costs, y’all should get the sandwiches right."
ORDERLY,"I’ll make sure we take care of that from now on, okay? Enjoy your lunch, Mrs. Ellison."
LORRAINE,I’m getting married.
CORALINE,Shut up!
MONK,What?!
LORRAINE,I didn’t say nothing earlier. It was just so sad. But Maynard asked me yesterday.
CORALINE,Lorraine! That’s amazing! Let’s celebrate!
LORRAINE,It’s too much excitement. I don’t like being the center of attention.
MONK,"Well, you deserve it, Lorraine. And Maynard is a lucky man."
LORRAINE,"Do you think you’d be willing to walk me down the aisle, Mr. Monk?"
MONK,I’d be honored. Wow.
PAULA,We are wildly excited to help you get “My Pafology” out. The marketing team has all kinds of great ideas to help sell it.
ARTHUR,Great. We’re excited to hear.
PAULA,John Bosco is the head of the department. I’ll let him tell you more.
JOHN,"Hi, Stagg."
MONK,Hello.
JOHN,"Nice to finally meet you, my man. Listen, I love the book, and we are going to sell many, many copies. There’s already so much buzz because of the movie deal, and we just want to keep that momentum going."
ARTHUR,I spoke to Wiley yesterday. He says Michael B. Jordan is circling.
PAULA,"We heard. We think he would be absolutely perfect. You know, this book is awards bait with a capital"
JOHN,"And we’re thinking that if Michael does sign on, we want to put him on the cover, in one of those, um...scarves, I guess you would call them, tied around his head."
MONK,A do-rag?
JOHN,Do-rag! That’s it. Do-rag and a tank top. With those muscles showing.
PAULA,Whoo. Somebody call the fire department.
JOHN,Yummy.
ARTHUR,"Shit, sorry, your dad. Sorry."
JOHN,"So listen, for a release date, we’re thinking of rushing it so that we can get it out in time for for Juneteenth."
PAULA,Yeah.
MONK,Juneteenth?
JOHN,"We’re thinking of making a big holiday push. Black people will be celebrating, white people will be feeling -- let’s be honest -- a little conscience-stricken. We think it’s gonna be a huge moment for your book."
JOHN,"So Stagg, are you so, so happy?"
ARTHUR,"We think it’s great, John. Really. Amazing."
MONK,"Yeah, it’s, uh -- it’s great. And, you know, I’ve got an idea I want to share with you two."
PAULA,"Oh, well, I mean, we always love to hear great ideas..."
JOHN,Yeah! Cool.
MONK,I want to change the title.
JOHN,"OK. Um, well, just to be clear, we love “My Pafology.”"
PAULA,Love it.
JOHN,"It’s got that Irvine Welsh, proletariat vernacular thang."
MONK,That’s why I think you’ll like the new title even more.
PAULA,"Well, OK. You know what? We are always happy to hear new ideas. What did you have in mind?"
MONK,“Fuck.”
PAULA,"Uh, I’m sorry. Pardon me?"
MONK,“Fuck.” I want to call it “Fuck.”
ARTHUR,What are you doing?
MONK,Screw these idiots.
ARTHUR,Stop it.
MONK,No.
PAULA,"So Stagg, what about, uh, like “Damn” -- “Damn” -- or “Hell”?"
MONK,Nah. “Fuck.”
JOHN,OK. That’s cool. But maybe we could maybe do that with a P-H instead? Because that would be more palatable to our sellers.
MONK,"I don’t care about all that. And if you don’t change the title, the deal is off."
JOHN,"Whoa, whoa, whoa."
PAULA,"Yeah, no, there’s no need to be hasty. You know what? Why don’t we-- just give us a second, and, um, a moment, and we will get right back to you. OK?"
ARTHUR,What are you doing?
MONK,What are you doing? This is ridiculous.
ARTHUR,It’s too much money we’re talking about.
MONK,I don’t care. I’m shutting it down.
ARTHUR,Shutting wha--
MONK,Shutting it down.
PAULA,Are you there?
ARTHUR,We’re here.
PAULA,Let’s do it!
ARTHUR,What?
MONK,What?
PAULA,"Yeah, we discussed it, and we think it is very in your face in the best way possible."
JOHN,"It’s very, uh --"
MONK,Black?
JOHN,"That’s it! Yes, that’s it. I’m happy you said it and not me."
PAULA,"Ah, fuck!"
JOHN,"It’s fucking great, Stagg."
PAULA,"You know, it’s so brave, actually."
CORALINE,I’m exhausted.
MONK,"Yeah, me too. But I’ve got to stay up a few hours reading these these books for --"
MONK,Hey! Hey! Hey!
CLIFF,"Ah, shit."
MONK,What are you doing here?
CLIFF,What am I doing here? What are you doing here?
MONK,What do you mean what am I doin-- Why are you in town?
MONK,I came to see our mother. Isn’t that what you’ve been calling me about for weeks now.
MONK,What happened to your eye?
CLIFF,I got in a fight.
MONK,"Well, get out of the pool."
MONK,You’re making a mess of it.
CLIFF,I don’t want to get out of the pool. I’m a grown ass man. Is this your girlfriend?
MONK,Yeah. You scared the shit out of her.
CORALINE,I’m Coraline.
CLIFF,"Hi, Coraline. At least she’s not white again."
MONK,Your wife was white.
CLIFF,My wife was a beard. Beards don’t count.
MONK,"Well, get out. Fuckin’ menace. You’ll wake the neighbors."
CLIFF,Fuck your neighbors. And fuck your clean pool. It’s all just a part of your superiority complex anyway.
MONK,You are a goddamn child!
CLIFF,It’s probably a bad time to tell you but I did piss down there.
MONK,"Oh, this is funny, huh?"
CORALINE,"I’m sorry, Monk."
CLIFF,Don’t get mad.
CLIFF,"So I’m lying in bed with him, buck ass naked, and in walks Claude carrying the frozen yogurt."
CORALINE,No!
CLIFF,"Yeah, I forgot that I’d shown him where I keep the spare key. So he just throws the yogurt at us and then he wallops me, right in the eye."
CORALINE,What’s the other guy do?
CLIFF,He couldn’t stop laughing. He said that’s what he does when he gets nervous.
MONK,You’re really going for it these days.
CLIFF,I’ve only been gay for like five minutes. I gotta make up for lost time.
CORALINE,"Good for you. The whole world’s falling apart, you might as well have some fun."
CLIFF,"I appreciate that. You know, you’re quite beautiful."
CORALINE,Thank you.
CLIFF,Can I -- What do you see in my brother?
CORALINE,He’s funny.
CLIFF,Hmm. He’s not funny.
CORALINE,"No, not “ha ha” funny. Like sad- funny."
CORALINE,Like a three-legged dog.
CLIFF,I see it now. Like somebody dying on the toilet.
CORALINE,Exactly.
MONK,"Invariably, you, you -- you go too far."
CLIFF,You think? I don’t think I go far enough.
MONK,It’s becoming hurtful.
CORALINE,Awww.
CLIFF,Awww.
CLIFF,"“Invariably, you, you, you go too far...”"
CLIFF,"You got a kiss, man! Look at you! Just by being pathetic."
CLIFF,Pathetic like a three-legged dog.
CLIFF,This is nice.
MONK,"Yeah, it’s not bad."
CLIFF,What do they got there? A pergola?
MONK,That’s a gazebo.
CLIFF,Same difference.
CLIFF,"Hey, Monk? How the hell can you afford this place?"
MONK,"I, uh, there was some money Lisa left for Mother."
CLIFF,I thought her divorce cleaned her out.
MONK,I’m not familiar with what her finances were like.
CLIFF,"Uh, that’s fine. Where are we going?"
MONK,Right here. 44.
MONK,Surprise.
ORDERLY,We’ve had a difficult morning.
DOCTOR,We had to sedate her after she tried to strike a nurse.
MONK,Has she done that before?
DOCTOR,No. She has a different demeanor every day. Sometimes every hour. Maybe she’ll feel better tomorrow. I’m sorry. I need to go.
MONK,"Yes, of course. Thank you."
CORALINE,"The gardener cut these right off the bush for your mom. Sweet, right?"
MONK,"Yeah, that’s great."
CORALINE,"How can you afford it here? You’re not a drug dealer or something, are you?"
MONK,"No, I’m a writer. And you’re my girlfriend, not my bookkeeper."
AGNES,I always knew you weren’t a queer.
MONK,She doesn’t know what she’s saying.
CLIFF,I’m going to wait outside.
MONK,Are you sure you don’t want to stay for Lorraine’s wedding?
CLIFF,It’s better if I go.
CORALINE,"It was nice to meet you, Cliff."
CLIFF,This family’ll break your heart.
KENYA,"Welcome back. I’m Kenya Dunston and today we’re going to discuss a new novel that just debuted at number one on the New York Times bestseller list. It is just a remarkable, special book. And it’s called -- cover your kids’ eyes and ears -- ."
KENYA,"We’re lucky enough to have the author with us today. And for those of you who are just joining us, please know that Mr. Stagg R. Leigh is coming to us from an undisclosed location, as he is still on the run from authorities."
KENYA,"Ah, Stagg. Tell us: is this novel a true story?"
MONK,"Not factually, but it is the true story of what it’s like to be black in America, like me. And it ain’t pretty."
KENYA,Amen to that.
MONK,"During my time in prison, I learned that words belong to everybody. So this book is my contribution to this wonderful country of ours. Where a black convict can become rich simply by telling the story of his unfortunate people."
KENYA,Mmm. Yes! Yes...
MONK,Yeah.
ARTHUR,Get this: The FBI called Thompson- Watt today to try to get Stagg R. Leigh’s identity.
MONK,What?
ARTHUR,Don’t worry. They’re not gonna give him up.
MONK,Give who up? It’s me. And I haven’t done anything.
ARTHUR,They don’t know that.
MONK,"Look, this has gone too far."
ARTHUR,"Relax. The fugitive stuff’s getting us mountains of free press. Plus, as you said, you haven’t done anything. It’s not like they can arrest you."
MONK,I wish I could go back to not selling books.
ARTHUR,I don’t. Bye.
CORALINE,Is everything alright?
MONK,Yeah. I’m just a little stressed out. This Book Award stuff is a bit more work than I expected.
MONK,Shit.
CORALINE,It’s no biggie. Got more forks in the kitchen.
MONK,What’s this?
CORALINE,"Oh, my friend got it for me. Have you read it?"
MONK,Of course not. Have you?
CORALINE,Yeah.
MONK,What’d you think of it?
CORALINE,I liked it.
MONK,What did you like about it?
CORALINE,"Um, I--"
MONK,It didn’t offend you?
CORALINE,You just said you didn’t read it. What’s your problem?
MONK,Why don’t you answer my question?
CORALINE,You answer mine.
